시장,제목,3줄요약,출처,URL,게시시간,다음행동,종목코드,종목명
미국주식,1 Profitable Stock to Research Further and 2 We Question,Not all profitable companies are built to last - some rely on outdated models or unsustainable advantages. Just because a business is in the green today doesn’t mean it will thrive tomorrow.,Yahoo,https://finnhub.io/api/news?id=e67c3e30266d4bbd9fc70f6997f4deb8cd88b0dc7a3b29ce4b42b50ea233edea,1777420135,,CAVA,CAVA
미국주식,Why Investors Need to Take Advantage of These 2 Retail-Wholesale Stocks Now,Why investors should use the Zacks Earnings ESP tool to help find stocks that are poised to top quarterly earnings estimates.,Yahoo,https://finnhub.io/api/news?id=277b5ea3099144f65b82398f9cf46cd42aefc8acf48a092a70143335d46d1638,1777467604,,CAVA,CAVA
미국주식,Best Growth Stock to Buy Right Now: Cava vs. Dutch Bros,Cava and Dutch Bros are two of the best growth stories in the restaurant space.,Yahoo,https://finnhub.io/api/news?id=bef4d8c04bb2093e49ddf35d26ee31a59c3e00a5d3c8bd47c66908d368bacd22,1777483440,,CAVA,CAVA
미국주식,Chipotle Mexican Grill (CMG) Q1 Earnings Meet Estimates,"Chipotle (CMG) delivered earnings and revenue surprises of -1.11% and +0.41%, respectively, for the quarter ended March 2026. Do the numbers hold clues to what lies ahead for the stock?",Yahoo,https://finnhub.io/api/news?id=f4c0057e2ebcc877ae10562d63822af6ec8f0389b40be771dea8537b825c65b1,1777499104,,CAVA,CAVA
미국주식,"CAVA to Announce First Quarter 2026 Financial Results on May 19, 2026","WASHINGTON, April 30, 2026--CAVA Group, Inc. (NYSE: CAVA), the category-defining Mediterranean fast-casual restaurant brand that brings heart, health, and humanity to food, will host a conference call",Yahoo,https://finnhub.io/api/news?id=807ce044452c78a66f0f526abd7e17aae6b34fa05af509662ee931385137bf35,1777579800,,CAVA,CAVA
미국주식,"RBC Capital Maintains Outperform on Cava Group, Raises Price Target to $100",RBC Capital  analyst Logan Reich   maintains Cava Group (NYSE:CAVA) with a Outperform and raises the price target from $90 to $100.,Benzinga,https://finnhub.io/api/news?id=6533dd609284319b05b52f683c7f4af80c96c629570763d47309dc040668a2d6,1777637171,,CAVA,CAVA
미국주식,"Cava Could Beat Quarterly Same-Store Sales Views, Lift 2026 Outlook Amid Continued Momentum, RBC Says",Cava Group's (CAVA) first-quarter same-store sales are expected to top Wall Street's estimates amid,Yahoo,https://finnhub.io/api/news?id=460b31d219995ddcff6cd6e8756f99b1cf82bebe31077ab70ba301e9d19ddff9,1777664652,,CAVA,CAVA
미국주식,3 Growth Stocks with Warning Signs,"Growth is a hallmark of all great companies, but the laws of gravity eventually take hold. Those who rode the COVID boom and ensuing tech selloff in 2022 will surely remember that the market’s punishm",Yahoo,https://finnhub.io/api/news?id=373f59f20dcae6a80f6f34a3177aa24169e565ea8da50a04d3c957ad1ea9850e,1777745575,,CAVA,CAVA
미국주식,CAVA Group: This Price Target Hike Signals Growing Confidence,"With year-to-date performance of 54.14% as of April 30 2026, CAVA Group, Inc. (NYSE:CAVA) is among the 10 Under-the-Radar Stocks That Are On Fire Right Now. CAVA Group, Inc. (NYSE:CAVA) has continued ",Yahoo,https://finnhub.io/api/news?id=c79580fbc4b50a476e15ed5175ced51509828b96edd0caf87189589f689cf174,1777805539,,CAVA,CAVA
미국주식,"Shares of several utility companies are trading lower amid market weakness as stocks sell-off amid COVID-19 concerns, a slower-than-expected vaccine rollout, and profit-taking following a 2020 surge in equities.",,Benzinga,https://finnhub.io/api/news?id=93fe150e5994049971e034d8bffad671da7de3c0bed20ccb5903e6ceb8fa4cdc,1609777225,,CEG,CEG
미국주식,"Here Are Friday’s Top Wall Street Analyst Research Calls: Advanced Micro Devices, Comcast, Draft Kings, IBM, Oracle, Shake Shack, Southwest Airlines, Tesla, and More",Pre-Market Stock Futures: Futures are trading mixed as we get set to close out a wild week on Wall Street that saw a little bit of everything served with a massive helping of volatility. After a stell,Yahoo,https://finnhub.io/api/news?id=256cc47a0e6216a42fcd4696cf88c39f80bd7f0e2a66f774a7b552d394138f47,1777032083,,CEG,CEG
미국주식,"Intel upgraded, DraftKings downgraded: Wall Street's top analyst calls","Intel upgraded, DraftKings downgraded: Wall Street's top analyst calls",Yahoo,https://finnhub.io/api/news?id=caef7dc83c266995df63e0cbcd5e0c26d9de9810fc26439ac207f580fffed3ac,1777038244,,CEG,CEG
미국주식,Constellation Energy vs. NextEra Energy: Which Utility Stock Wins Now?,"NEE tops CEG on price gains, dividend yield and capex plans as U.S. clean-power demand and prices climb.",Yahoo,https://finnhub.io/api/news?id=d877841c4d6f6a470ed9a1388096ab91fd9cd379af9ea5516a5b3af28d416c86,1777042320,,CEG,CEG
미국주식,The 1 Energy Stock You Should Be Buying for the $700 Billion AI Spending Spree,"The market has a funny way of chasing what’s visible while missing what actually powers it. Everyone is focused on AI chips, software, and trillion-dollar tech giants. But here’s the question investor",Yahoo,https://finnhub.io/api/news?id=01403f84db7ab137c36ac48dabc6889abd46e9a894872dfa833e4355d70b2b30,1777046909,,CEG,CEG
미국주식,Uncover the latest developments among S&P500 stocks in today's session.,Curious about the S&P500 stocks that are in motion on Friday? Join us as we explore the top movers within the S&P500 index during today's session.,ChartMill,https://finnhub.io/api/news?id=57fbda71592450f4e8d0911b7cbafc725583ff04126ea6c1144a6361c7a1f787,1777057503,,CEG,CEG
미국주식,Constellation Energy’s Calpine Deal Reshapes Scale Valuation And Clean Power Role,Constellation Energy (NasdaqGS:CEG) has completed its US$26.6b acquisition of Calpine. The deal nearly doubles Constellation's generating capacity to about 55 GW. Management indicates the combined com,Yahoo,https://finnhub.io/api/news?id=d887fa74e31b7bc229a1cab193793aa8c1788e6b3266eb4536614ba22f9c0ca1,1777071948,,CEG,CEG
미국주식,"Oklo Is Interesting, but This Nuclear Stock Is a Better Buy","Oklo's liquid-metal cooled SMR technology is impressive, but you can invest in that technology without anywhere near as much risk.",Yahoo,https://finnhub.io/api/news?id=546417b62318bc32e6cc27f3ddcdeccb4357b545ec46eb352967a2bf4ee27083,1777201320,,CEG,CEG
미국주식,Barron's Top 10 ESG Dogs Tag 4 As 'Safer' For April Dividends,Calvertâs top 10 sustainable ESG dividend stocks for 2026âtargets imply ~24% upside and highlight safer picks and entry points. Read the full analysis here.,SeekingAlpha,https://finnhub.io/api/news?id=bae129b71c40d12b64f2472ee4976bf6fdbfa1d0f94936dd60fd94220c17f1cc,1777202695,,CEG,CEG
미국주식,Evercore ISI Resumes Coverage of Constellation Energy (CEG) with a Bullish Stance,"Constellation Energy Corporation (NASDAQ:CEG) is included among the 10 Best Nuclear Energy Stocks to Buy for Dividends. Constellation Energy Corporation (NASDAQ:CEG) is the largest provider of clean, ",Yahoo,https://finnhub.io/api/news?id=ad9a2575063925fe8ee3c44fcdfe2b0a7ecfe3e2887b4125526cb4ded43071e0,1777213024,,CEG,CEG
미국주식,"40 years after Chernobyl, nuclear energy is back in focus","CNBC’s Brian Sullivan looks at how the nuclear industry is recovering from the reputational fallout of the Chernobyl disaster, and why AI is putting nuclear back in the spotlight.",CNBC,https://finnhub.io/api/news?id=a8ef3f716ea2e76fd21f38938d9a032a82c969e2754375056f30abf5a1819603,1777309259,,CEG,CEG
미국주식,Can Constellation Energy (CEG) Capitalize on the Growing Demand for Clean Electricity?,"Constellation Energy Corporation (NASDAQ:CEG) is one of the 10 Best Under-the-Radar Data Center Stocks to Buy. In the past year, the company’s stock jumped 36.87%, while it posted a 21.59% percent yea",Yahoo,https://finnhub.io/api/news?id=0dcec96f22f6de4327f03a64047725eace065524783322064bd89d5552ef1f4c,1777315216,,CEG,CEG
미국주식,"Constellation Energy: Lower Price Improves Upside, But Uncertainty Remains",Constellation Energy's Q4 operating margin fell from 18.1% to 9.8%. Click here to read more about CEG stock and why it is a Hold.,SeekingAlpha,https://finnhub.io/api/news?id=257e94dfef4cae90c3b2bd740ba53cfcf6743ba80401a1c35488ac172c59f2a4,1777341893,,CEG,CEG
미국주식,Constellation Energy: Riding Nuclear Demand And The AI Power Boom,Constellation Energy's Calpine acquisition adds 23 GW capacity and expands into Texas/California. Read why CEG stock is a Buy.,SeekingAlpha,https://finnhub.io/api/news?id=f2a4b5b0263e57e17325bd26f926230b0db66eebf8c30a8b7fb4057c7e693ea2,1777345785,,CEG,CEG
미국주식,Microsoft Deal Puts Constellation Energy At Heart Of AI Power Story,Constellation Energy (NasdaqGS:CEG) is partnering with Microsoft to restart the Three Mile Island nuclear facility to supply power to data centers. The agreement focuses on providing carbon free elect,Yahoo,https://finnhub.io/api/news?id=74fecdf9b6d0ad1d7dc34d8c5de23277b7d8108815f50df9ac0c9ee89475d6e1,1777350467,,CEG,CEG
미국주식,"Barclays Maintains Overweight on Constellation Energy, Lowers Price Target to $358",Barclays  analyst Nicholas Campanella   maintains Constellation Energy (NASDAQ:CEG) with a Overweight and lowers the price target from $360 to $358.,Benzinga,https://finnhub.io/api/news?id=c7fe4e984c00ac39fdce43468fd0075aecae0e6f8d92362ee218a9ffa0065021,1777368346,,CEG,CEG
미국주식,"Nucor shares are trading higher after the company reported better-than-expected Q1 financial results. Also, BMO Capital and UBS raised their respective price targets on the stock.",,Benzinga,https://finnhub.io/api/news?id=e0b70d3ee746cfc2272a1334e9ae82a053569cbdfd1f27b5b3d1df1dd97b6478,1777380659,,CEG,CEG
미국주식,Constellation Energy shares are trading lower after Barclays lowered its price target on the stock from $360 to $358.,,Benzinga,https://finnhub.io/api/news?id=67d512a0fbccedf97bfeadbe799ad55d15e7132cfe48cc0bb7d40ca4d21850e4,1777383294,,CEG,CEG
미국주식,"Constellation Energy Corporation Declares Dividend, Payable on June 5, 2026","Constellation Energy Corporation declared a quarterly dividend of $0.4265 per share on Constellation?s common stock. The dividend is payable on June 5, 2026, to shareholders of record as of 5 p.m....",Finnhub,https://finnhub.io/api/news?id=2c8f7c57138984e9d09f12ccdc97bb710b1ef344fc3a99516d61a5312ccbd97b,1777386032,,CEG,CEG
미국주식,Constellation Energy declares qtrly dividend of $0.4265 per share,Constellation Energy Corp: Constellation Energy Corp - declares qtrly dividend of $0.4265 per share...,Finnhub,https://finnhub.io/api/news?id=259b81c97a49ca4a9bdaa3c4d9d93401feff58026af378ce0fdf0d025e79d2cc,1777390255,,CEG,CEG
미국주식,Shares of restaurant stocks are trading higher after NY Fed President Williams indicated he sees room for a further policy adjustment in the near term. This has lifted overall market sentiment.,,Benzinga,https://finnhub.io/api/news?id=1800a13382da83185726c07d9231485c49ad1307e2769262ceb25b3c60475bfe,1763742903,,CELH,CELH
미국주식,3 Reasons to Avoid CELH and 1 Stock to Buy Instead,"What a brutal six months it’s been for Celsius. The stock has dropped 46.2% and now trades at $34.07, rattling many shareholders. This might have investors contemplating their next move.",Yahoo,https://finnhub.io/api/news?id=4c281056e1ccbcd7fd7da1b95227d4cf7935116243baaac83973218d42c2b2a0,1777054883,,CELH,CELH
미국주식,Where Will Celsius Stock Be in 5 Years?,"This emerging energy drink business used to be a high-flying stock, but it now trades 65% off its peak.",Yahoo,https://finnhub.io/api/news?id=7213746e095a7bdc7bf36f26e91d138b219481134400f9f93d11549cf1c802ef,1777210800,,CELH,CELH
미국주식,Celsius Targets Soccer And Studio Fans To Deepen Brand Engagement,"Celsius Holdings (NasdaqCM:CELH) launches ELECTRIC VIBE, a limited edition, soccer inspired product tied to a new sports focused marketing push. The company rolls out a major campaign featuring athlet",Yahoo,https://finnhub.io/api/news?id=48a367064dad8295261b2b57872e7463c3659ffb0d9ec785d78f324b66e2decd,1777248895,,CELH,CELH
미국주식,Does Celsius (CELH) Soccer-Themed Flavor Push Reveal a Deeper Lifestyle Brand Strategy?,"Celsius Holdings recently launched ELECTRIC VIBE, a limited-edition Sparkling Tropical Freeze flavor inspired by soccer culture, alongside a soccer-themed marketing campaign and its Celsius Soccer Cla",Yahoo,https://finnhub.io/api/news?id=c1671575b814d584d2501103ffdbcca91a5bebd36ce001370654a5004f49367f,1777273492,,CELH,CELH
미국주식,Celsius Holdings Inc. (CELH) Stock Declines While Market Improves: Some Information for Investors,"Celsius Holdings Inc. (CELH) reached $33.14 at the closing of the latest trading day, reflecting a -4.19% change compared to its last close.",Yahoo,https://finnhub.io/api/news?id=d61f33adb2cff494e22e6072801d2c8092aeb7db0409c26c30aa490553d5b38e,1777326305,,CELH,CELH
미국주식,Celsius Holdings Inc. (CELH) to Report Q1 Results: Wall Street Expects Earnings Growth,Celsius (CELH) possesses the right combination of the two key ingredients for a likely earnings beat in its upcoming report. Get prepared with the key expectations.,Yahoo,https://finnhub.io/api/news?id=6fad5a640c5a94a553d6607da33e5ce790f7fb42fa8dc0c911aeb5d430e1b380,1777384820,,CELH,CELH
미국주식,Celsius vs. Dutch Bros: Which Growth Stock Wins in This Market?,Both businesses are finding success in competitive consumer-facing industries.,Yahoo,https://finnhub.io/api/news?id=68b3b0cf1d074eff118146a78a27a6c6a7ebf34e2e3e461c5bde61650bf57cfc,1777466220,,CELH,CELH
미국주식,Celsius Holdings Inc. (CELH) is Attracting Investor Attention: Here is What You Should Know,"Celsius (CELH) has been one of the stocks most watched by Zacks.com users lately. So, it is worth exploring what lies ahead for the stock.",Yahoo,https://finnhub.io/api/news?id=6ca209b518d2f43751468d60de26c485f071cb882fc28691ec7e84609fd5ab49,1777467604,,CELH,CELH
미국주식,J&J Snack Foods (JJSF) Earnings Expected to Grow: Should You Buy?,J&J Snack Foods (JJSF) doesn't possess the right combination of the two key ingredients for a likely earnings beat in its upcoming report. Get prepared with the key expectations.,Yahoo,https://finnhub.io/api/news?id=840cd0b572fd99b02a9dc8814947c90bdd3a376e78155b15aea60c5c71e00439,1777471231,,CELH,CELH
미국주식,"Celsius Holdings to Release First Quarter Results on Thursday, May 7, 2026","BOCA RATON, Fla., April 30, 2026--Celsius Holdings, Inc. will release its first quarter 2026 financial results before markets open on Thursday, May 7, 2026.",Yahoo,https://finnhub.io/api/news?id=b77cb93f5b12d02c9ff213f07a4e7a9f7d66864302557e38fc23778360bc84f1,1777579500,,CELH,CELH
미국주식,Here's How Much $100 Invested In Celsius Holdings 10 Years Ago Would Be Worth Today, ,Benzinga,https://finnhub.io/api/news?id=4647e3c8449c9c882b7b0abb9987f25a1f7dd6a3026069797e1065beed0fc0ab,1777637777,,CELH,CELH
미국주식,"JP Morgan Maintains Overweight on Celsius Holdings, Lowers Price Target to $67",JP Morgan  analyst Andrea Teixeira   maintains Celsius Holdings (NASDAQ:CELH) with a Overweight and lowers the price target from $77 to $67.,Benzinga,https://finnhub.io/api/news?id=f04685c3b2006097e4c5e864f687fad69de629f4c7c9e51464deba3cf2ff3501,1777914786,,CELH,CELH
미국주식,Celsius: Premium Growth At A Compelling Multiple,"Celsius is poised for a potential Q1 earnings beat after a transformational 2025, with two major acquisitions scaling its portfolio. See why CELH stock is a Buy.",SeekingAlpha,https://finnhub.io/api/news?id=e416063789a58dfcab438d0991507eac0795f94e5cef9f4279d3c2a056b8d8a3,1777959611,,CELH,CELH
미국주식,3 Consumer Stocks Walking a Fine Line,"Consumer staples are considered safe havens in turbulent markets due to their inelastic demand profiles. But they’re also double-edged swords as they often lag in booming conditions, and this pattern ",Yahoo,https://finnhub.io/api/news?id=4bf5db03d0275958d8eb8b076b6760156328a5527c5904b1b9cf48f410b23625,1777969735,,CELH,CELH
미국주식,Celsius Taps Soccer Fandom With Electric Vibe Launch And Investor Implications,"Celsius Holdings (NasdaqCM:CELH) launched a limited-edition ELECTRIC VIBE flavor tied to major soccer events. The campaign features soccer-themed branding and content with celebrity athletes, creators",Yahoo,https://finnhub.io/api/news?id=8e07bd6796ff9c192e5387cab66be0acadda288f1f0b278c577476a7e3afe4ed,1777975785,,CELH,CELH
미국주식,Will Celsius Holdings Stock Extend Its Earnings Beat Streak in Q1?,"CELH eyes Q1 surge, revenues seen up 129% and EPS up 61% as the PepsiCo partnership, new products and marketing fuel demand.",Yahoo,https://finnhub.io/api/news?id=a7c6a2d1ed18c3c91e89f3dcdb894c471333b1a408e7e62060d8428863b04b56,1777986720,,CELH,CELH
미국주식,A Look At Celsius Holdings (CELH) Valuation After Recent Share Price Weakness And Growth Reassessment,"Recent price performance and business snapshot Celsius Holdings (CELH) has drawn attention after a weaker share price pattern in the past 3 months and year to date, inviting a closer look at how the c",Yahoo,https://finnhub.io/api/news?id=040dd30526f44e8a4954abc27a5b3b7c99293ed937d686e3a649e4e473cdbfd5,1778033680,,CELH,CELH
미국주식,J&J Snack Foods (JJSF) Q2 Earnings Surpass Estimates,"J&J Snack Foods (JJSF) delivered earnings and revenue surprises of +2.56% and -0.05%, respectively, for the quarter ended March 2026. Do the numbers hold clues to what lies ahead for the stock?",Yahoo,https://finnhub.io/api/news?id=15bf3a261a8b2af33f636a36e5430d553917b0366a1edd17de2ec05bb8883c68,1778070305,,CELH,CELH
미국주식,"Rothschild & Co Initiates Coverage On Celsius Holdings with Neutral Rating, Announces Price Target of $47",Rothschild &amp; Co  analyst Charlie Higgs   initiates coverage on Celsius Holdings (NASDAQ:CELH) with a Neutral rating and announces Price Target of $47.,Benzinga,https://finnhub.io/api/news?id=cbd5c04e572127a66d6f9e41f983affee3b0d981e9a0e3cdfb975edda9ecab4e,1778071209,,CELH,CELH
미국주식,Shares of several companies in the broader technology sector are trading lower amid overall weakness as stocks continue to sell off following worse-than-expected May CPI data. Rising inflation and an increase in US Treasury yields has also weighed on the sector.,,Benzinga,https://finnhub.io/api/news?id=2bdc933ca5c7b11de9e58d45b8ffda130acab48134a4dfac8b81e52add563fca,1655113941,,COHR,COHR
미국주식,Lumentum Holdings shares are trading higher after Morgan Stanley maintained an Equal-Weight rating on the stock and raised its price target from $520 to $595.,,Benzinga,https://finnhub.io/api/news?id=5fe0ebdb9f8939f614562655b72630c32f57f7b053b24076d74a6539b37aa60b,1773849191,,COHR,COHR
미국주식,Shares of quantum computing-related companies are trading higher amid continued strength after NVIDIA recently announced the launch of Ising open source quantum AI models.,,Benzinga,https://finnhub.io/api/news?id=af3c964b58c41970101af8a466eb63f85746399b2344620aadf16cdc28a8eb02,1776324980,,COHR,COHR
미국주식,Discover the top S&P500 movers in Monday's pre-market session.,"As we await the opening of the US market on Monday, let's delve into the pre-market session and discover the S&P500 top gainers and losers shaping the early market sentiment.",ChartMill,https://finnhub.io/api/news?id=92e445107f5872415fda0aee45cc7d51a26f17912135e8a92854550659810c95,1777898103,,COHR,COHR
미국주식,Fiserv Gears Up to Report Q1 Earnings: Here's What You Should Know,"FISV heads into Q1 earnings release with mixed segment trends, as Clover-driven growth offsets declines in financial solutions and earnings.",Yahoo,https://finnhub.io/api/news?id=23ff1b6dc97a9ce713d5317dbab38dbdd78753935042d41fbc352bd516286c09,1777912440,,COHR,COHR
미국주식,Gartner Gears Up to Report Q1 Earnings: What's in the Offing?,"IT heads into Q1 earnings release, with a slight top-line dip expected, as Conferences growth helps offset softer Insights and Consulting trends.",Yahoo,https://finnhub.io/api/news?id=bb08c0e711f47aa620482e773f67592cc1ce63a98e31d9ac7172ef16bd7d416f,1777914060,,COHR,COHR
미국주식,Remitly Global Set to Report Q1 Earnings: What's in the Cards?,"RELY gears up for Q1 results with strong revenue growth expectations, driven by higher send volumes, Flex demand and expanding digital adoption.",Yahoo,https://finnhub.io/api/news?id=73254e6fdf719eeadd4d57737a4c67b3605a4cf9b1965b54f086852f015bf3f5,1777914120,,COHR,COHR
미국주식,Symbotic Gears Up to Report Q2 Earnings: What's in the Cards?,"SYM heads into Q2 earnings with strong revenue growth expectations, fueled by deployments, the Fox Robotics acquisition and rising systems demand.",Yahoo,https://finnhub.io/api/news?id=d0dcd1ae9df8838b12d75a5d52a281a4e25fd5f07d4329bcf345db9dfc9fc292,1777916040,,COHR,COHR
미국주식,Will Top-Line Improvement Aid Arm Holdings' Q4 Earnings?,"ARM heads into fiscal Q4 earnings with 18% revenue growth expected, but the model signals mixed odds for a beat despite strong royalty and licensing momentum.",Yahoo,https://finnhub.io/api/news?id=26fa6e310d89f57123914476a7dce6fec55b5164017069f9109450b14087a496,1777916880,,COHR,COHR
미국주식,Carillon Chartwell Small Cap Growth Fund: Q1 2026 Portfolio Movers,The fund reports strong IT performance driven by data center CAPEX and AI research spending. Read the full analysis for more details.,SeekingAlpha,https://finnhub.io/api/news?id=7228903f54030f1164d9c6cfe058d0fd768759c1b1e59a0eeed4242a152bb744,1777939800,,COHR,COHR
미국주식,"Stifel Maintains Buy on Coherent, Raises Price Target to $412",Stifel  analyst Ruben Roy   maintains Coherent (NYSE:COHR) with a Buy and raises the price target from $275 to $412.,Benzinga,https://finnhub.io/api/news?id=e3b5b48e13ab7b2d3b5adc4922e6207d9c1c3e4363063d3fe8431cc58661cddf,1777979339,,COHR,COHR
미국주식,"These 3 Telecom Stocks Rallied Over 1,000% In A Year: Nvidia Did 75%","Lumentum, Ondas and Applied Optoelectronics rallied over 1,000% in 12 months. Two report earnings this week. Wall Street is split.",Benzinga,https://finnhub.io/api/news?id=8ebbe7f16377f91da9ec251ce7ded20f67dd43b8f79b95c2a8855c1ab032c71b,1777980887,,COHR,COHR
미국주식,"Cipher Digital Inc. (CIFR) Reports Q1 Loss, Tops Revenue Estimates","Cipher Digital Inc. (CIFR) delivered earnings and revenue surprises of -3.70% and +3.35%, respectively, for the quarter ended March 2026. Do the numbers hold clues to what lies ahead for the stock?",Yahoo,https://finnhub.io/api/news?id=eb92d0d9c084e310c61c6cd32094d1886d8d9d1ef9b901f65928cc55bec97bff,1777986904,,COHR,COHR
미국주식,AAOI Stock Before Q1 Earnings: Smart Buy or Risky Move?,"Applied Optoelectronics reports Q1 2026 earnings on May 7, guiding $150M-$165M revenues as CATV and data center demand stay strong.",Yahoo,https://finnhub.io/api/news?id=b0526c0178b3b75230116f07c07f4b41ce6ac97224e3dd6f9d4ffe999535f66c,1778000280,,COHR,COHR
미국주식,Amprius Technologies Set to Report Q1 Earnings: What's in the Cards?,"AMPX heads into Q1 results with strong revenue growth expectations, fueled by battery demand, NDAA tailwinds and expanding market traction.",Yahoo,https://finnhub.io/api/news?id=ec2984a8bc32c4436740fba42a76dfa56aeec56dc549401f8291c9703c29f109,1778000940,,COHR,COHR
미국주식,Coherent (COHR) Reports Earnings Tomorrow: What To Expect,Materials and photonics company Coherent (NYSE:COHR) will be announcing earnings results this Wednesday after market hours. Here’s what investors should know.,Yahoo,https://finnhub.io/api/news?id=8d87758e11678e1b6d7ee80cc4c16ee54914c4fcb40477fac25f293896d49a42,1778013415,,COHR,COHR
미국주식,Lumentum Earnings Beat Estimates. Why the Stock Is Dropping.,"Lumentum shares fall after the optical networking giant reported fiscal third-quarter earnings, narrowly missing lofty revenue expectations.",Yahoo,https://finnhub.io/api/news?id=f04c99262d36aaaf1bdcbd954b47a7eeed69ca4369dfae964dd418b1382409ec,1778016180,,COHR,COHR
미국주식,Nvidia to invest up to $3.2 billion in Corning as part of massive optical fiber deal with 3 new factories focused on AI,Corning is opening three new advanced manufacturing plants in the U.S. dedicated entirely to optical technologies for Nvidia. ,CNBC,https://finnhub.io/api/news?id=091574a854f8d41dfb3499e237f8435c379e0f005592fe24f11bb4bd60a6ad73,1778052601,,COHR,COHR
미국주식,Nvidia Is Facing More Competition and It’s Spooking Investors,"(Bloomberg) -- This earnings season has delivered plenty of good news for the artificial intelligence trade, but instead of bidding up Nvidia Corp. shares, investors have been dumping them.Most Read f",Yahoo,https://finnhub.io/api/news?id=4dd918c8c490174770c831061fee6e56ebe6acc0901a3b0aa08e43b2131fd520,1778065288,,COHR,COHR
미국주식,Lumentum Stock Has Soared Since Joining the S&P 500. Why Earnings Put a Pause in the Rally.,"Lumentum shares fall after the optical networking giant reported fiscal third-quarter earnings, narrowly missing lofty revenue expectations.",Yahoo,https://finnhub.io/api/news?id=039ec955c4e160f5d7706f50ec73328e6fbc1ff5a2b3f006422794c647d249b8,1778079120,,COHR,COHR
미국주식,"Shares of financial services companies are trading higher after President Trump's social media post indicated that the U.S. will work closely with Iran, and the countries have already agreed to several key points in the proposed conflict-resolution plan. The sector is also benefiting from easing energy prices and lower Treasury yields, which are helping to alleviate inflation concerns and support overall market sentiment.",,Benzinga,https://finnhub.io/api/news?id=fd68eded809a26927512b66a99602c772d962f461b07f10662101b210a436d7b,1775655424,,COIN,COIN
미국주식,Coinbase Won the Crypto Bill but Lost the Easy Yield,Senate Banking's bipartisan stablecoin compromise handed Coinbase regulatory clarity while stripping out its most passive revenue stream.,Yahoo,https://finnhub.io/api/news?id=2c96021bf9d667769c238af006c67811bfeb472d6b1903bc4e277f918ec9a10d,1778672640,,COIN,COIN
