시장,제목,3줄요약,제목_한글,요약_한글,출처,URL,게시시간,다음행동,종목코드,종목명
미국주식,"Bitmine Immersion Technologies (BMNR) Announces ETH Holdings Reach 5.28 Million Tokens, and Total Crypto and Total Cash Holdings of $12.6 Billion",Bitmine owns more than 4.37% of the total ETH coin supply of 120.7 millionBitmine is 87% of the way to the 'Alchemy of 5%' in just 11 monthsEthereum continues to benefit from the dual tailwinds of...,"Bitmine Immersion Technologies (BMNR) Announces ETH Holdings Reach 5.28 Million Tokens, and Total Crypto and Total Cash Holdings of $12.6 Billion",Bitmine owns more than 4.37% of the total ETH coin supply of 120.7 millionBitmine is 87% of the way to the 'Alchemy of 5%' in just 11 monthsEthereum continues to benefit from the dual tailwinds of...,Finnhub,https://finnhub.io/api/news?id=79ff9c92570e431b78055b426d0df106b03f0ac97a7096946472e3195dddce99,1779093133,,BMNR,BMNR
미국주식,"Bitmine Reports Crypto + Total Cash Holdings + ""Moonshots"" Of $12.6B, Including 5.28M ETH Tokens, Total Cash Of $685M, And Other Crypto Holdings",Bitmine owns more than 4.37% of the total ETH coin supply of 120.7 millionBitmine is 87% of the way to the &#39;Alchemy of 5%&#39; in just 11 monthsEthereum continues to benefit from the dual tailwind,"Bitmine Reports Crypto + Total Cash Holdings + ""Moonshots"" Of $12.6B, Including 5.28M ETH Tokens, Total Cash Of $685M, And Other Crypto Holdings",Bitmine owns more than 4.37% of the total ETH coin supply of 120.7 millionBitmine is 87% of the way to the &#39;Alchemy of 5%&#39; in just 11 monthsEthereum continues to benefit from the dual tailwind,Benzinga,https://finnhub.io/api/news?id=d41d5d4f6666f59e42c2e73cad72d9acbfe044de4f1fbc2938cdb0fed36e3ea9,1779093470,,BMNR,BMNR
미국주식,"Bitmine Buys 71,672 ETH, But Tom Lee Says Oil Is The 'The Biggest Headwind'","BitMine Immersion Technologies Inc. (NASDAQ:BMNR) purchased 71,672 Ethereum ","Bitmine Buys 71,672 ETH, But Tom Lee Says Oil Is The 'The Biggest Headwind'","BitMine Immersion Technologies Inc. (NASDAQ:BMNR) purchased 71,672 Ethereum",Benzinga,https://finnhub.io/api/news?id=6442ebd6d974ce2d178194c73400ee26159010995f58ab273cea98ed4822fb78,1779099710,,BMNR,BMNR
미국주식,"Bitcoin, Ethereum, XRP Flat, While Dogecoin Slides  As Trump Steps Up War Rhetoric : Analyst Flags Significance Of $70,500 For BTC","Leading cryptocurrencies stagnated, while stocks closed lower on Monday after President Donald Trump hinted at a “large-scale” assault on Iran.","Bitcoin, Ethereum, XRP Flat, While Dogecoin Slides  As Trump Steps Up War Rhetoric : Analyst Flags Significance Of $70,500 For BTC","Leading cryptocurrencies stagnated, while stocks closed lower on Monday after President Donald Trump hinted at a “large-scale” assault on Iran.",Benzinga,https://finnhub.io/api/news?id=9e34af9a6e558dd8bc1fbdee5401d4b710e51669ca9e11d889ea58787f70be21,1779143181,,BMNR,BMNR
미국주식,"Bitcoin, Ethereum Tread Water, XRP, Dogecoin Slide Amid Trump's 'Limited' Period Warning On Iran: Analyst Says BTC 'Doesn't Look Great'",Leading cryptocurrencies stayed weak alongside stocks on Tuesday as President Donald Trump warned the U.S. would wait only for a &#34;limited period of time&#34; if a deal with Iran is not made sooner,"Bitcoin, Ethereum Tread Water, XRP, Dogecoin Slide Amid Trump's 'Limited' Period Warning On Iran: Analyst Says BTC 'Doesn't Look Great'",Leading cryptocurrencies stayed weak alongside stocks on Tuesday as President Donald Trump warned the U.S. would wait only for a &#34;limited period of time&#34; if a deal with Iran is not made sooner,Benzinga,https://finnhub.io/api/news?id=1720825b9f8023a524b145436c2f2d56e1e9c6594f3abd4fcc079703eb396860,1779228502,,BMNR,BMNR
미국주식,Model Allocation Update (May 2026),"Defensive, diversified model portfolio update: inflation-beneficiary equities and All-Weather ETFs to navigate volatility, inflation and geopoliticsâread...",Model Allocation Update (May 2026),"Defensive, diversified model portfolio update: inflation-beneficiary equities and All-Weather ETFs to navigate volatility, inflation and geopoliticsâread...",SeekingAlpha,https://finnhub.io/api/news?id=792b47c139991c642194507af5cc8d5c4f1600c3fb7f617633ff6aeef704029d,1779266325,,BMNR,BMNR
미국주식,South Korean Funeral Firm Loses $33 Million on BitMine Ethereum ETF,"Bumo Sarang lost $33M of customer prepaid funds on a 2x leveraged BitMine ETF, exposing South Korea's loose funeral rules.",South Korean Funeral Firm Loses $33 Million on BitMine Ethereum ETF,"Bumo Sarang lost $33M of customer prepaid funds on a 2x leveraged BitMine ETF, exposing South Korea's loose funeral rules.",Yahoo,https://finnhub.io/api/news?id=85849dc62e431f584e884ba07e941c52747d5ccd9f69af59319dd6a3e4c7dc33,1779286640,,BMNR,BMNR
미국주식,"Bitcoin, Ethereum, XRP, Dogecoin Rebound On Trump's Iran Remarks: Analyst Says Watch Out For This BTC Level",Leading cryptocurrencies rallied alongside stocks on Wednesday as President Donald Trump’s latest remarks on Iran helped ease geopolitical tensions. Cryptocurrency24-Hour Gains +/-Price (Recorded at 9,"Bitcoin, Ethereum, XRP, Dogecoin Rebound On Trump's Iran Remarks: Analyst Says Watch Out For This BTC Level",Leading cryptocurrencies rallied alongside stocks on Wednesday as President Donald Trump’s latest remarks on Iran helped ease geopolitical tensions. Cryptocurrency24-Hour Gains +/-Price (Recorded at 9,Yahoo,https://finnhub.io/api/news?id=a0eeabb6dddab0d70b56109f1ff9f89dd7ba494ecfd1cae87ffd8f63ec0570fa,1779329554,,BMNR,BMNR
미국주식,Tom Lee Says Ethereum Will Rise When Oil Falls — And It All Comes Down To Fed Policy,"BMNR chairman Tom Lee pointed to the April FOMC minutes, which warned policymakers may need additional “policy firming” if inflation remains above the Fed’s 2% target.",Tom Lee Says Ethereum Will Rise When Oil Falls — And It All Comes Down To Fed Policy,"BMNR chairman Tom Lee pointed to the April FOMC minutes, which warned policymakers may need additional “policy firming” if inflation remains above the Fed’s 2% target.",Yahoo,https://finnhub.io/api/news?id=0e0f5a5380704f4df109894e7b1598c37c67bec7a04590f785df014967f959bd,1779374654,,BMNR,BMNR
미국주식,"Bitcoin, Ethereum, XRP, Dogecoin Move Sideways: Analyst Says Middle East Ceasefire 'Best Trigger' For Crypto Market Strength","Leading cryptocurrencies moved sideways, while stocks rose further on Thursday, as traders pinned their hopes on an Iran ceasefire. Cryptocurrency24-Hour Gains +/-Price (Recorded at 9:10 p.m. EDT)Bitc","Bitcoin, Ethereum, XRP, Dogecoin Move Sideways: Analyst Says Middle East Ceasefire 'Best Trigger' For Crypto Market Strength","Leading cryptocurrencies moved sideways, while stocks rose further on Thursday, as traders pinned their hopes on an Iran ceasefire. Cryptocurrency24-Hour Gains +/-Price (Recorded at 9:10 p.m. EDT)Bitc",Yahoo,https://finnhub.io/api/news?id=a00140e1c80a5dd871235232920d7aa2689fab8b98325c65141b8665791515ef,1779414304,,BMNR,BMNR
미국주식,"Ethereum-Focused SBET And BMNR Join Russell 3000 Index, Following MSTR's Playbook",SharpLink Gaming and BitMine Immersion enter the index despite mixed earnings results as Ethereum trades down more than 4% in the past 24 hours.,"Ethereum-Focused SBET And BMNR Join Russell 3000 Index, Following MSTR's Playbook",SharpLink Gaming and BitMine Immersion enter the index despite mixed earnings results as Ethereum trades down more than 4% in the past 24 hours.,Yahoo,https://finnhub.io/api/news?id=0fb843f8e3cb915318bf5209caa36d1aca642feaea2d762b39404758b4e98cf1,1779540941,,BMNR,BMNR
미국주식,BitMine Could Enter Russell 3000 Index With Ethereum Treasury,BitMine could join the Russell 3000 Index while Saylor hints Strategy may sell some Bitcoin during 2026 ahead.,BitMine Could Enter Russell 3000 Index With Ethereum Treasury,BitMine could join the Russell 3000 Index while Saylor hints Strategy may sell some Bitcoin during 2026 ahead.,Yahoo,https://finnhub.io/api/news?id=9b66740fdb7929717bedf304814c17ff6d39dc71bc0893140d2aef6dec358513,1779568627,,BMNR,BMNR
미국주식,"Tom Lee’s BMNR Is Sitting On $8 Billion In Unrealized Losses On Its Ethereum Position, Eyes A Russell 1000 Inclusion",Tom Lee continues warning that broader markets could face a major correction later this year despite record equity levels.,"Tom Lee’s BMNR Is Sitting On $8 Billion In Unrealized Losses On Its Ethereum Position, Eyes A Russell 1000 Inclusion",Tom Lee continues warning that broader markets could face a major correction later this year despite record equity levels.,Yahoo,https://finnhub.io/api/news?id=87b4ce7249b5deb6942a620088936a208ff99e96dec4ed654665a3b2e656d6dc,1779638888,,BMNR,BMNR
미국주식,"Bitcoin, Ethereum, XRP, Dogecoin Flat Amid Iran Deal Uncertainty: Crypto Commentator Says 'Everyone's Bearish' On ETH, But Data Isn't","Leading cryptocurrencies paused gains, while stock futures surged on Sunday after President Donald Trump urged officials not to rush into a deal with Iran.","Bitcoin, Ethereum, XRP, Dogecoin Flat Amid Iran Deal Uncertainty: Crypto Commentator Says 'Everyone's Bearish' On ETH, But Data Isn't","Leading cryptocurrencies paused gains, while stock futures surged on Sunday after President Donald Trump urged officials not to rush into a deal with Iran.",Benzinga,https://finnhub.io/api/news?id=f88f266169114b2c104791eabb2c97df9358609f9386deff2b3c7684c569afca,1779659792,,BMNR,BMNR
미국주식,How Investors May Respond To BitMine Immersion (BMNR) Share Resale Registration And Added Supply Overhang,"In recent days, BitMine Immersion Technologies filed to register the resale of 501,545 common shares held by existing shareholders, allowing those investors to sell into the open market. This move doe",How Investors May Respond To BitMine Immersion (BMNR) Share Resale Registration And Added Supply Overhang,"In recent days, BitMine Immersion Technologies filed to register the resale of 501,545 common shares held by existing shareholders, allowing those investors to sell into the open market. This move doe",Yahoo,https://finnhub.io/api/news?id=eaa505154c60ab360b6b07228e9f8ec22bb6986ec431973eb53b341c2a98a981,1779714787,,BMNR,BMNR
미국주식,BitMine Considered For Russell 1000 Inclusion,Ethereum (CRYPTO: $ETH) treasury company BitMine Immersion Technologies (NYSE: $BMNR) is being considered for inclu...,BitMine Considered For Russell 1000 Inclusion,Ethereum (CRYPTO: $ETH) treasury company BitMine Immersion Technologies (NYSE: $BMNR) is being considered for inclu...,Yahoo,https://finnhub.io/api/news?id=9641e72d5d810c5a853fe9746b54b570463dbb3bd1b61d460b22db3ab7a2a78f,1779715140,,BMNR,BMNR
미국주식,Ethereum Price Drop Deepens: Tom Lee’s Portfolio Bleeds $7.8 Billion,Tom Lee’s BitMine is facing roughly $7.8 billion in unrealized Ethereum losses as ETH remains deep in a prolonged downtrend. Ethereum has fallen more than ...,Ethereum Price Drop Deepens: Tom Lee’s Portfolio Bleeds $7.8 Billion,Tom Lee’s BitMine is facing roughly $7.8 billion in unrealized Ethereum losses as ETH remains deep in a prolonged downtrend. Ethereum has fallen more than ...,Yahoo,https://finnhub.io/api/news?id=16f4762c8e0ecd9d0cb6c09bf26369bacf389605d406b0c3fc1b1eb256ac12d0,1779719536,,BMNR,BMNR
미국주식,"BitMine Purchases 60,000 Ethereum As Price Languishes","BitMine (NYSE: $BMNR) purchased an additional 60,000 Ethereum (CRYPTO: $ETH) over the past week as the price langui...","BitMine Purchases 60,000 Ethereum As Price Languishes","BitMine (NYSE: $BMNR) purchased an additional 60,000 Ethereum (CRYPTO: $ETH) over the past week as the price langui...",Yahoo,https://finnhub.io/api/news?id=2acdc40c76db309991aa1e65a095a5612a63cb360aa76e99bff5274fc0c1217a,1779733920,,BMNR,BMNR
미국주식,Tom Lee Outlines Liquidity Catalyst for Ethereum Firm BitMine Following Russell Index Update,The Ethereum-buying firm owns 4.3% of the digital asset’s supply.,Tom Lee Outlines Liquidity Catalyst for Ethereum Firm BitMine Following Russell Index Update,The Ethereum-buying firm owns 4.3% of the digital asset’s supply.,Yahoo,https://finnhub.io/api/news?id=a77ef4a042f4dad6c1d452ea07a05cc01906f8ac1d29515ffe8e73da37c42685,1779739564,,BMNR,BMNR
미국주식,Next Technology: Dilution Overpowers Bitcoin Exposure,Next Technology Holding Inc. shifts from Strong Sell to Hold as core business revenue emerges but execution remains unproven.,Next Technology: Dilution Overpowers Bitcoin Exposure,Next Technology Holding Inc. shifts from Strong Sell to Hold as core business revenue emerges but execution remains unproven.,SeekingAlpha,https://finnhub.io/api/news?id=c162176368136b8c46f934a51f75d6e96a89c08ea8db971d61d414d685525a83,1779090898,,BTC-USD,BTC-USD
미국주식,Bitcoin Options Have Turned Defensive Near $77K,"BTC options have turned defensive near $77K, with short-dated puts clustered around $75.5-77K and net delta flat to slightly negative. Read more here...",Bitcoin Options Have Turned Defensive Near $77K,"BTC options have turned defensive near $77K, with short-dated puts clustered around $75.5-77K and net delta flat to slightly negative. Read more here...",SeekingAlpha,https://finnhub.io/api/news?id=54d2b5be877edbb3e179342d7f8442e599d5e9ec20574e9a75b33d97760bc250,1779192300,,BTC-USD,BTC-USD
미국주식,MSBT: There's A New Kid On The Block,"Explore Bitcoin ETFs: structure, investor appeal, and key risks like regulation, liquidity & tracking. Read the full analysis here.",MSBT: There's A New Kid On The Block,"Explore Bitcoin ETFs: structure, investor appeal, and key risks like regulation, liquidity & tracking. Read the full analysis here.",SeekingAlpha,https://finnhub.io/api/news?id=10e386e632103e552aa4300180f5a68fefb335e7d5572f119af7f4d0372ef03a,1779211307,,BTC-USD,BTC-USD
미국주식,Whale's Insight: U.S. Equities Rally To ATH - Why Hasn't Bitcoin Followed?,"U.S. equities hit all-time highs on AI and U.S.-China optimism, but BTC stays pinned near $80,000. Read more here.",Whale's Insight: U.S. Equities Rally To ATH - Why Hasn't Bitcoin Followed?,"U.S. equities hit all-time highs on AI and U.S.-China optimism, but BTC stays pinned near $80,000. Read more here.",SeekingAlpha,https://finnhub.io/api/news?id=5baec5aa6edd3bd1fdeadd5212b63db06ccef97b12d4147b5b8a5876abec42d1,1779264600,,BTC-USD,BTC-USD
미국주식,Model Allocation Update (May 2026),"Defensive, diversified model portfolio update: inflation-beneficiary equities and All-Weather ETFs to navigate volatility, inflation and geopoliticsâread...",Model Allocation Update (May 2026),"Defensive, diversified model portfolio update: inflation-beneficiary equities and All-Weather ETFs to navigate volatility, inflation and geopoliticsâread...",SeekingAlpha,https://finnhub.io/api/news?id=792b47c139991c642194507af5cc8d5c4f1600c3fb7f617633ff6aeef704029d,1779266325,,BTC-USD,BTC-USD
미국주식,Market Brief: Bitcoin's Last Dip? What The Money Is Telling Us,"Bitcoin has recently slid to $76K. From the early-May local high near $82K, that is roughly a 7.5% drawdown in two weeks.",Market Brief: Bitcoin's Last Dip? What The Money Is Telling Us,"Bitcoin has recently slid to $76K. From the early-May local high near $82K, that is roughly a 7.5% drawdown in two weeks.",SeekingAlpha,https://finnhub.io/api/news?id=f8aa731b424756350ceb96589abad24d444ba6a0cfcf5843ba2f7ad8614d395e,1779332700,,BTC-USD,BTC-USD
미국주식,"Strategy's Operating Business Is A Liability, Not An Asset","Strategy (MSTR) stock outlook: despite Bitcoin gains, rising debt, dilution, and operating losses increase downside risk.","Strategy's Operating Business Is A Liability, Not An Asset","Strategy (MSTR) stock outlook: despite Bitcoin gains, rising debt, dilution, and operating losses increase downside risk.",SeekingAlpha,https://finnhub.io/api/news?id=e12676cb3eee803036025bb7be677dff37a8969d8e5367aa2c2f00f1c5b9b165,1779358756,,BTC-USD,BTC-USD
미국주식,Bitcoin And Ethereum Technical Outlook: Cryptos Pulled Back But Sentiment Rebounds - Opportunity?,,Bitcoin And Ethereum Technical Outlook: Cryptos Pulled Back But Sentiment Rebounds - Opportunity?,,SeekingAlpha,https://finnhub.io/api/news?id=1351570e309b320223ef7e4900b88097be314c63cd251dad5e8ce025b124c944,1779409200,,BTC-USD,BTC-USD
미국주식,VanEck Mid-May 2026 Bitcoin ChainCheck,"Bitcoin recovered +11.8% m/m to ~$78,272, but options open interest stayed flat and put premiums collapsed -51%, indicating the rally is spot-driven, not levered. Read more here.",VanEck Mid-May 2026 Bitcoin ChainCheck,"Bitcoin recovered +11.8% m/m to ~$78,272, but options open interest stayed flat and put premiums collapsed -51%, indicating the rally is spot-driven, not levered. Read more here.",SeekingAlpha,https://finnhub.io/api/news?id=481f75e48673698691485ac1938f56fbd1ee75050fe60eb7bce73a94efd0b51f,1779499800,,BTC-USD,BTC-USD
미국주식,Weekly Commentary: The Warsh Fed,Ten-year Treasury yields have jumped 90 bps since the Fed began its 175 bps rate-cutting cycle in September 2024. Read more here.,Weekly Commentary: The Warsh Fed,Ten-year Treasury yields have jumped 90 bps since the Fed began its 175 bps rate-cutting cycle in September 2024. Read more here.,SeekingAlpha,https://finnhub.io/api/news?id=29538514869c5fbc083f282358e1a0231d1ec43eeca99bc9eed3edf0cac02847,1779511246,,BTC-USD,BTC-USD
미국주식,Bitcoin: The Next Leg Down Could Be Near (Rating Upgrade),"Bitcoin is following historical price cycles, with a likely bear market bottom projected for September or October 2026. Read more on BTC-USD here.",Bitcoin: The Next Leg Down Could Be Near (Rating Upgrade),"Bitcoin is following historical price cycles, with a likely bear market bottom projected for September or October 2026. Read more on BTC-USD here.",SeekingAlpha,https://finnhub.io/api/news?id=4f05310a285c7d52b1e92df3b6b9e9e32b8e348419d8a59a8128b2789efbef9f,1779578940,,BTC-USD,BTC-USD
미국주식,A $100 Billion Liquidity Drain May Hit Markets This Week,Treasury issuance is tightening liquidity and pressuring stocks & Bitcoin through mid-June and into September. Read the full analysis here.,A $100 Billion Liquidity Drain May Hit Markets This Week,Treasury issuance is tightening liquidity and pressuring stocks & Bitcoin through mid-June and into September. Read the full analysis here.,SeekingAlpha,https://finnhub.io/api/news?id=7d6455cfefe9ebca008dd5463828a5521e1c045df53ae8562ad7fdf2a6619197,1779616800,,BTC-USD,BTC-USD
미국주식,A Final Path To Peace? Markets Weekly Outlook,"Market participants endured a rollercoaster of emotions over the past five sessions. As the geopolitical clouds begin to clear, traders are aggressively recalibrating their portfolios.",A Final Path To Peace? Markets Weekly Outlook,"Market participants endured a rollercoaster of emotions over the past five sessions. As the geopolitical clouds begin to clear, traders are aggressively recalibrating their portfolios.",SeekingAlpha,https://finnhub.io/api/news?id=e986cc0c83d17f6be2e71d7843d36973b68f8f7618813c0c90449e5ef9f12228,1779622500,,BTC-USD,BTC-USD
미국주식,Whale's Insight: The Bond Market Just Broke - Where Does That Leave Bitcoin?,High yields pushed crypto into stocks. U.S. spot Bitcoin ETFs saw $649 million in single-day outflows.,Whale's Insight: The Bond Market Just Broke - Where Does That Leave Bitcoin?,High yields pushed crypto into stocks. U.S. spot Bitcoin ETFs saw $649 million in single-day outflows.,SeekingAlpha,https://finnhub.io/api/news?id=d825009db07c1bbc1498f3d7a07fa9e701cc9f0be0231705765a4a6aa8abc46f,1779699000,,BTC-USD,BTC-USD
미국주식,Bitcoin's Upside Signal Faded; Ethereum Remains The Fragile Side,"Bitcoin briefly flashed a clean upside setup overnight, then pulled it back. That is the most important change in this 24-hour read. ETH is near $2.10K, also down about 0.9%.",Bitcoin's Upside Signal Faded; Ethereum Remains The Fragile Side,"Bitcoin briefly flashed a clean upside setup overnight, then pulled it back. That is the most important change in this 24-hour read. ETH is near $2.10K, also down about 0.9%.",SeekingAlpha,https://finnhub.io/api/news?id=32e89931be6ed994499f393ce1430a4782e843fc1068493b308b02f3e6ae9717,1779789300,,BTC-USD,BTC-USD
미국주식,Bitcoin And Ethereum Technical Outlook: Cryptos Fail To Generate Momentum Continuous Confusion,Bitcoin and Ethereum continue to move sideways with ongoing confusion regarding the Iran peace process,Bitcoin And Ethereum Technical Outlook: Cryptos Fail To Generate Momentum Continuous Confusion,Bitcoin and Ethereum continue to move sideways with ongoing confusion regarding the Iran peace process,SeekingAlpha,https://finnhub.io/api/news?id=ddee4846f35ee1688435fa1bedbcbd7cbd631cb3827a80254babb8ba31709c08,1779829500,,BTC-USD,BTC-USD
미국주식,"Bitcoin Held The $75K Test, But Options Confirmation Is Still Narrow",BTC is no longer only defensive near $77K. The new tape is better than the previous report. It just has not done enough to earn a clean bullish reset. ETH is seeing a fragile rebound.,"Bitcoin Held The $75K Test, But Options Confirmation Is Still Narrow",BTC is no longer only defensive near $77K. The new tape is better than the previous report. It just has not done enough to earn a clean bullish reset. ETH is seeing a fragile rebound.,SeekingAlpha,https://finnhub.io/api/news?id=c8f6ec1a47b5151982363bee76040c7059f76e5bcf74864f5e1eac55d7178577,1779867000,,BTC-USD,BTC-USD
미국주식,"Bitcoin Drops Below $76,000 And Enters Correction Phase","Bitcoin (BTC-USD) has moved into a noticeable decline after several months of steady growth. In recent sessions, BTC has fallen back below the $76,000 level. Read more here...","Bitcoin Drops Below $76,000 And Enters Correction Phase","Bitcoin (BTC-USD) has moved into a noticeable decline after several months of steady growth. In recent sessions, BTC has fallen back below the $76,000 level. Read more here...",SeekingAlpha,https://finnhub.io/api/news?id=036309646bd09fafba41e86f807f5ffb4fceeb7c097fb875b49dc3feb00bdf72,1779873000,,BTC-USD,BTC-USD
미국주식,"As Asset Managers Exit Crypto, The Music May Be Stopping For Many Cryptocurrencies","Crypto stocks beat Bitcoin YTD as AI pivots and stablecoins drive rotation. See key 13F shifts, my BTC BUY view, and why most crypto isnât.","As Asset Managers Exit Crypto, The Music May Be Stopping For Many Cryptocurrencies","Crypto stocks beat Bitcoin YTD as AI pivots and stablecoins drive rotation. See key 13F shifts, my BTC BUY view, and why most crypto isnât.",SeekingAlpha,https://finnhub.io/api/news?id=048ca4232068d3f03138e8ba47f1ee364d8420e1ca2130bf9238338198b248c6,1779882239,,BTC-USD,BTC-USD
미국주식,Market Brief: Why Japan's Rate Hike Could Hit Crypto And Nvidia At Once,"To hold its current 0.75% policy rate, the BOJ would have to print yen and absorb unwanted bonds itself, which risks crashing the currency further.",Market Brief: Why Japan's Rate Hike Could Hit Crypto And Nvidia At Once,"To hold its current 0.75% policy rate, the BOJ would have to print yen and absorb unwanted bonds itself, which risks crashing the currency further.",SeekingAlpha,https://finnhub.io/api/news?id=0bbf71731cc0ad680cbf1239045fd368f470bc55fd5ac3466af9fa0ff3650c96,1779934800,,BTC-USD,BTC-USD
미국주식,SpaceX Stock Will Cost Less Than You Think. It’s a Red Flag for Markets.,"SpaceX is targeting a $1.75 trillion valuation in an IPO next week, according to the Wall Street Journal.",SpaceX Stock Will Cost Less Than You Think. It’s a Red Flag for Markets.,"SpaceX is targeting a $1.75 trillion valuation in an IPO next week, according to the Wall Street Journal.",Yahoo,https://finnhub.io/api/news?id=d775bf1ac513822f3fa3a7592e6b2dfcee0f9e799860ae59eb1be6e1d40452b0,1780488780,,CAT,CAT
미국주식,SpaceX Target Valuation Lowered Again. Why That’s a Red Flag for the Stock Market.,"SpaceX is targeting a $1.75 trillion valuation in an IPO next week, according to The Wall Street Journal.",SpaceX Target Valuation Lowered Again. Why That’s a Red Flag for the Stock Market.,"SpaceX is targeting a $1.75 trillion valuation in an IPO next week, according to The Wall Street Journal.",Yahoo,https://finnhub.io/api/news?id=bed820459b410b999197038fc37f3989056fb3143e1954917687be16ca18982e,1780496580,,CAT,CAT
미국주식,Top dow jones movers in Wednesday's session,Join us in exploring the top gainers and losers within the dow jones index in the middle of the day on Wednesday as we examine the latest happenings in today's session.,Top dow jones movers in Wednesday's session,Join us in exploring the top gainers and losers within the dow jones index in the middle of the day on Wednesday as we examine the latest happenings in today's session.,ChartMill,https://finnhub.io/api/news?id=7e1cb0184f6aeb9ddbe16925bff29adde63c5afab579bff30d0eeaf1f3ab0d26,1780504802,,CAT,CAT
미국주식,"Stock Of The Day, A Dow Jones Member And AI Play, Reaches Buy Point",Economic currents have turned in the company's favor as it turns into an artificial-intelligence play both as a user and supplier.,"Stock Of The Day, A Dow Jones Member And AI Play, Reaches Buy Point",Economic currents have turned in the company's favor as it turns into an artificial-intelligence play both as a user and supplier.,Yahoo,https://finnhub.io/api/news?id=226f27fde91f07163d70392cd097d404c4918a57491ef97e2ae3d8260d91d4d1,1780505549,,CAT,CAT
