시장,제목,3줄요약,제목_한글,요약_한글,출처,URL,게시시간,다음행동,종목코드,종목명
미국주식,"After Gaining 800% in 1 Year, Wall Street Just Upgraded Micron to ""Strong Buy"" -- Unanimously. Here's Why.","Micron has been on an incredible run, but could there be more upside ahead?","1년 만에 800% 를 얻은 월스트리트는 마이크론을 만장일치로 ""강력한 구매"" 로 업그레이드했습니다. 그 이유는 다음과 같습니다.",Micron은 놀라운 달리기를 해왔지만 앞으로 더 많은 거꾸로가있을 수 있습니까?,The Motley Fool,https://www.fool.com/investing/2026/06/30/after-gaining-800-in-1-year-wall-street-just-upgra/,2026-06-30T10:12:59Z,뉴스만으로 매수하지 말고 가격·수급·재무를 함께 확인,,종목
미국주식,"Our rating, price target and outlook for newly spun Honeywell Aerospace","Given the robust backlog, streamlined operations, and high demand for its products, we see plenty of upside in our newest position.","새로 회전한 Honeywell Aerospace에 대한 평가, 가격 목표 및 전망","탄탄한 잔고, 능률적인 운영, 자사 제품에 대한 높은 수요를 감안할 때, 우리는 최신 위치에서 많은 장점을 볼 수 있습니다.",CNBC,https://www.cnbc.com/2026/06/29/our-rating-price-target-and-outlook-for-newly-spun-honeywell-aerospace.html,2026-06-29T20:02:09Z,뉴스만으로 매수하지 말고 가격·수급·재무를 함께 확인,,종목
미국주식,"Pregnant Woman, 35, Says Fiancé And His 14-Year-Old Daughter Think She's 'Ridiculous' For Putting $50K Lottery Win Aside For Baby, But Not Her Too","A $50,000 scratch-off ticket was supposed to be the easiest financial decision of Rachel’s life. Instead, it sparked a debate over fairness, favoritism and whether a baby who hasn’t even been born sho...","35세의 임산부는 약혼자와 그의 14세 딸이 아기를 위해 $ 50,000의 복권 당첨금을 제쳐놓고 '우스꽝스럽다' 고 생각한다고 말합니다.","$ 50,000의 스크래치 오프 티켓은 레이첼의 인생에서 가장 쉬운 재정적 결정으로 여겨졌습니다. 대신, 그것은 공정성, 편애, 그리고 태어나지도 않은 아기가 쇼를하는지 여부에 대한 논쟁을 불러 일으켰습니다...",Yahoo,https://www.yahoo.com/lifestyle/articles/pregnant-woman-35-says-fianc-140107083.html,2026-06-29T14:01:07Z,뉴스만으로 매수하지 말고 가격·수급·재무를 함께 확인,,종목
미국주식,'Magnificent 7' stocks are having a dreadful year,It's been a horrid year so far for the Magnificent Seven.,'매그니피센트 7' 주식은 끔찍한 한 해를 보내고 있습니다,웅장한 7인조에게는 지금까지 끔찍한 한 해였습니다.,Yahoo Finance,https://finance.yahoo.com/markets/article/magnificent-7-stocks-are-having-a-dreadful-year-134333813.html?guce_referrer=aHR0cHM6Ly9uZXdzLmdvb2dsZS5jb20vXy9Eb3RzU3BsYXNoVWkvZGF0YS9iYXRjaGV4ZWN1dGU&guce_referrer_sig=AQAAABbFSDY_n0uI8pjk74SGl39WTLwtZKONxEYpLyqaWx3S2qG0jsqK4aGNxf18oW8ksmTojiA5I7RbeRf9oPx9X5hp83mLJMXA2-MCg-VHj44v-iVBZri8f0Y7fSP-qXMOEfDX5p5xzC97-KDVlAKnKEsNv926z_S7faxvdPXzLi1Y&_guc_consent_skip=1782745654,2026-06-29T13:43:33Z,뉴스만으로 매수하지 말고 가격·수급·재무를 함께 확인,,종목
미국주식,Why Aren’t Gas Prices Falling Faster? Chevron CFO Responds As Trump Turns Up The Heat On Big Oil: 'Doing Everything That We Can...',"Chevron Corp.‘s Chief Financial Officer Eimear Bonner has forecasted a gradual but eventual drop in U.S. gasoline prices as the situation in the Middle East stabilizes. Bonner, addressing criticism from President Donald Trump, told CNBC on Thursday that energy companies...",왜 유가가 더 빨리 떨어지지 않나요? Chevron CFO는 트럼프가 큰 기름에 열을 올리면서 응답합니다: '우리가 할 수있는 모든 것을하는 것...',Chevron Corp. 의 최고 재무 책임자 (CFO) 인 Eimear Bonner는 중동 상황이 안정화됨에 따라 점진적이지만 궁극적으로 미국 휘발유 가격이 하락할 것으로 예측했습니다. 도널드 트럼프 대통령의 비판에 대해 언급한 보너는 목요일 CNBC와의 인터뷰에서 에너지 회사들이...,Yahoo Finance,https://finance.yahoo.com/energy/articles/why-aren-t-gas-prices-193104397.html?guce_referrer=aHR0cHM6Ly9uZXdzLmdvb2dsZS5jb20vXy9Eb3RzU3BsYXNoVWkvZGF0YS9iYXRjaGV4ZWN1dGU&guce_referrer_sig=AQAAAErp6yJ0ATw0bLZVeZLiout4hvY1sEInElylmmh7SBH5XGKXk_6KfV9RIHspoYhJmLxZm4N7tpLLLv7aCSuZYMyr2F4CWUaEFk8z89UbKViwQqyERCm5LX-wA9W92V2-3RRkY-JK0-9cVmWcAl-dImGemzrlSiHn71grxDoHdNV_&_guc_consent_skip=1782712075,2026-06-28T19:31:04Z,뉴스만으로 매수하지 말고 가격·수급·재무를 함께 확인,,종목
미국주식,It's Time To Go All-In On SCHD,"Schwab US Dividend Equity ETF offers mature, profitable businesses at a blended P/E of 15.6x, a significant discount to the S&P 500. Click for more on SCHD.",SCHD에서 올인해야 할 때입니다,Schwab 미국 배당 주식 ETF는 S&P 500에 상당한 할인인 15.6배의 혼합 P/E로 성숙하고 수익성 있는 비즈니스를 제공합니다. SCHD에 대한 자세한 내용을 보려면 클릭하십시오.,Seeking Alpha,https://seekingalpha.com/article/4917776-its-time-to-go-all-in-on-schd,2026-06-28T13:30:00Z,뉴스만으로 매수하지 말고 가격·수급·재무를 함께 확인,,종목
미국주식,"‘We should be at $2.25 at the pump’: Trump says Exxon, Chevron, Shell and BP are price gouging drivers. Do you agree?",Trump said he had instructed the DOJ to ‘immediately start looking into this.’,"‘우리는 펌프에서 $ 2.25 에 있어야합니다’: 트럼프는 Exxon, Chevron, Shell 및 BP가 가격 가우징 드라이버라고 말합니다. 동의하십니까?",트럼프 대통령은 법무부에 ‘즉시 이 문제를 조사하라‘ 고 지시했다고 말했다.,Yahoo Finance,https://finance.yahoo.com/energy/articles/2-25-pump-trump-says-131500941.html?guce_referrer=aHR0cHM6Ly9uZXdzLmdvb2dsZS5jb20vXy9Eb3RzU3BsYXNoVWkvZGF0YS9iYXRjaGV4ZWN1dGU&guce_referrer_sig=AQAAANf-JxfBJv16w6v2TuMIFIwwwD5rBLb56BgREmaJXUH1YEAzI0YAUEViV1HdamN-T1ZKsGiU4lSHCYs9l-GOLmsnEKlWot_bJQ7uM-5q6EXyfqelNFVJ-bDiF0-lXBZ2Rh9pfKFq2yGmSJ6xwv7nx9VgPkUo3923BNXRuRzGLwbR&_guc_consent_skip=1782661772,2026-06-28T13:15:00Z,뉴스만으로 매수하지 말고 가격·수급·재무를 함께 확인,,종목
미국주식,Marjorie Taylor Greene Says It Is 'Awful' That 'No One Is Standing Up For Cancer Patients' After Bayer Scores Roundup Victory In Supreme Court,"Former Rep. Marjorie Taylor Greene criticized both the U.S. Supreme Court and President Donald Trump after the court sided with Bayer AG in a major Roundup lawsuit, saying “no one is standing up for c...",마조리 테일러 그린 (Marjorie Taylor Greene) 은 대법원에서 바이엘이 반올림 승리를 거둔 후 '아무도 암 환자를 위해 나서지 않는다' 는 것이 '끔찍하다' 고 말한다.,마조리 테일러 그린 전 하원의원은 법원이 주요 라운드업 소송에서 바이엘 AG의 편을 든 후 미국 대법원과 도널드 트럼프 대통령을 비판하면서 “아무도...,Yahoo,https://www.yahoo.com/news/politics/articles/marjorie-taylor-greene-says-awful-223104790.html,2026-06-27T22:31:04Z,뉴스만으로 매수하지 말고 가격·수급·재무를 함께 확인,,종목
미국주식,How Kohl's lost its way - and is trying to become relevant again,"Kohl's went from a household name to a plunging stock as it lost relevancy and its core customer. Now, the company is trying to turn itself around.",콜이 길을 잃고 다시 관련성을 갖기 위해 노력하는 방법,Kohl 's는 관련성과 핵심 고객을 잃으면서 가계 이름에서 급락하는 주식으로 변했습니다. 이제 회사는 스스로를 돌리려고 노력하고 있습니다.,CNBC,https://www.cnbc.com/2026/06/27/how-kohls-lost-its-way-and-is-trying-to-become-relevant-again.html,2026-06-27T12:00:01Z,뉴스만으로 매수하지 말고 가격·수급·재무를 함께 확인,,종목
미국주식,"With Just 6 Words, Fed Chair Kevin Warsh Demolished Expectations. ""It's Hard to Believe,"" Says President Trump.","The new Fed chair signaled a major policy shift, and not everyone was happy.","단 6단어로 케빈 워시 연준 의장은 기대치를 무너뜨렸습니다. 트럼프 대통령은 ""믿기 어렵다"" 고 말합니다.","새로운 연방준비제도이사회 (Fed) 의장은 주요 정책 변화를 알렸고, 모두가 만족하는 것은 아니었다.",Yahoo Finance,https://finance.yahoo.com/economy/policy/articles/just-6-words-fed-chair-112000094.html,2026-06-27T11:20:00Z,뉴스만으로 매수하지 말고 가격·수급·재무를 함께 확인,,종목
미국주식,Why Is Marvell Technology (MRVL) Stock Rocketing Higher Today,Shares of networking chips designer Marvell Technology (NASDAQ: MRVL) jumped 5.7% in the afternoon session after Micron's blowout day signaled that AI-driven chip demand is structurally undersupplied ,오늘날 Marvell Technology (MRVL) Stock Rocketing이 더 높은 이유,네트워킹 칩 디자이너 Marvell Technology (NASDAQ: MRVL) 의 주식은 마이크론의 블로우아웃 데이가 AI 기반 칩 수요가 구조적으로 공급 부족하다는 신호를 보낸 후 오후 세션에서 5.7% 급증했습니다.,Yahoo,https://finnhub.io/api/news?id=8b9618bc8dc234af0cda34d2c31402e1a00f2890cf94a43630bc249ca3b557be,1779865524,,ASML,ASML
미국주식,"Amtech, Semtech, and Applied Materials Stocks Trade Up, What You Need To Know",A number of stocks jumped in the afternoon session after Micron's blowout day signaled that AI-driven chip demand is structurally undersupplied which is bullish news for the equipment makers and found,"Amtech, Semtech 및 응용 재료 주식 거래, 알아야 할 사항",마이크론의 폭파일이 AI 중심의 칩 수요가 구조적으로 공급되지 않는다는 신호를 보낸 후 오후 세션에서 많은 주식이 뛰어 올랐습니다. 이는 장비 제조업체에게 낙관적 인 뉴스이며 발견되었습니다.,Yahoo,https://finnhub.io/api/news?id=574ecd6b7429dca88eb67cb16c9ae3fee949f886681b590c06ecc799471d7ff6,1779866004,,ASML,ASML
미국주식,"Photronics and Lam Research Shares Are Soaring, What You Need To Know",A number of stocks jumped in the afternoon session after Micron's blowout day signaled that AI-driven chip demand is structurally undersupplied which is bullish news for the equipment makers and found,광전자 및 램 리서치 주식이 급증하고 있습니다. 알아야 할 사항,마이크론의 폭파일이 AI 중심의 칩 수요가 구조적으로 공급되지 않는다는 신호를 보낸 후 오후 세션에서 많은 주식이 뛰어 올랐습니다. 이는 장비 제조업체에게 낙관적 인 뉴스이며 발견되었습니다.,Yahoo,https://finnhub.io/api/news?id=b67f838608807b238361dcd4a402e00e09b0001a8d9cc44894133e4a2b9aa2f1,1779866964,,ASML,ASML
미국주식,"FormFactor, Amkor, and Teradyne Shares Are Soaring, What You Need To Know",A number of stocks jumped in the afternoon session after Micron's blowout day signaled that AI-driven chip demand is structurally undersupplied which is bullish news for the equipment makers and found,"FormFactor, Amkor 및 Teradyne 주식이 급증하고 있습니다. 알아야 할 사항",마이크론의 폭파일이 AI 중심의 칩 수요가 구조적으로 공급되지 않는다는 신호를 보낸 후 오후 세션에서 많은 주식이 뛰어 올랐습니다. 이는 장비 제조업체에게 낙관적 인 뉴스이며 발견되었습니다.,Yahoo,https://finnhub.io/api/news?id=80d4f502881b5bf4bf80f7440a3dd20eff623b3a64a7fec309bc3299e9390a85,1779867444,,ASML,ASML
미국주식,Why KLA Corporation (KLAC) Stock Is Up Today,Shares of semiconductor manufacturing equipment maker KLA Corporation (NASDAQ:KLAC) jumped 6.6% in the afternoon session after Micron's blowout day signaled that AI-driven chip demand is structurally ,오늘 KLA Corporation (KLAC) 의 재고가 증가하는 이유,반도체 제조 장비 메이커 KLA 코퍼레이션 (NASDAQ: KLAC) 의 주식은 마이크론의 블로우아웃 데이가 인공지능 중심의 칩 수요가 구조적이라는 신호를 보낸 후 오후 세션에서 6.6% 급증했다.,Yahoo,https://finnhub.io/api/news?id=9080f95e9a985afaa7ea00525ed0cadc40fb171dc4ac6c01f0c178a89150d73b,1779870804,,ASML,ASML
미국주식,Goldman Says Nvidia and Micron Are the Biggest AI Winners: 5 Stocks to Take Advantage of it Now,"Goldman Sachs just named NVIDIA and Micron Technology the biggest AI winners of the next earnings cycle, and the stock is already moving. Micron is up 214% year-to-date. If you are still trying to dec",골드만은 엔비디아와 마이크론이 가장 큰 AI 승자라고 말합니다: 지금 활용해야 할 5가지 주식,"Goldman Sachs는 NVIDIA와 Micron Technology를 다음 수익 주기의 가장 큰 AI 수상자로 선정했으며, 주식은 이미 움직이고 있습니다. 마이크론은 전년 대비 214% 증가했습니다. 여전히 DEC를 시도하는 경우",Yahoo,https://finnhub.io/api/news?id=8ef4a713af0b752853f71c00272dac14b93a058371d12c457e60470a22d59659,1779916391,,ASML,ASML
미국주식,ASML (ASML) Stock Slides as Market Rises: Facts to Know Before You Trade,"In the most recent trading session, ASML (ASML) closed at $1, indicating a -2.09% shift from the previous trading day.",ASML (ASML) 시장 상승에 따른 주식 슬라이드: 거래 전에 알아야 할 사실,가장 최근 거래 세션에서 ASML (ASML) 은 전 거래일보다 -2.09% 변동된 $ 1에 마감했습니다.,Yahoo,https://finnhub.io/api/news?id=47c00b98f9e7d9f2a23dc3f8cb8af40bc0a11f3a01ce21517cc5bd4a44f18b76,1779918302,,ASML,ASML
미국주식,"French AI firm Mistral announces deals with BMW, Airbus",French AI firm Mistral on Thursday announced partnerships with carmaker BMW and aerospace company Airbus as it aims to boost its growth by fostering links with defence and industry giants.His group si,"프랑스 AI 기업 미스트랄, BMW, 에어버스와 거래 발표",프랑스 AI 기업 미스트랄 (Mistral) 은 목요일 자동차 메이커 BMW 및 항공우주 기업 에어버스 (Airbus) 와의 파트너십을 발표하면서 방위 산업 및 거대 기업과의 연계를 통해 성장을 촉진하는 것을 목표로 하고 있다고 발표했다. 그의 그룹 si,Yahoo,https://finnhub.io/api/news?id=814f8f71f791ce65a2787d8d2cf39ce7be389f29078044e8c38687a23726439b,1779960813,,ASML,ASML
미국주식,ASML: Why Europe's AI Giant Is Not The Best Chip Buy,"ASML stock remains a ""Hold"" despite a Q1 earnings beat, raised 2026 guidance, and AI-driven EUV demand. Learn more about its valuation.",ASML: 유럽의 AI 거대 기업이 최고의 칩 구매가 아닌 이유,"ASML 주식은 1분기 실적 부진, 2026년 가이던스 상승, AI 중심의 EUV 수요에도 불구하고 여전히 ""보류"" 상태입니다. 평가에 대해 자세히 알아보세요.",SeekingAlpha,https://finnhub.io/api/news?id=dc715b4673b997900c0c35b695f98ed43a6c8634589250dc9058a69312269d26,1779966949,,ASML,ASML
미국주식,"ASML Holding N.V. (ASML) Stock Gains Attention After UBS Lifts Price Target to €1,900",We recently compiled a list of the 12 Best Strong Buy Tech Stocks to Invest In Now. ASML Holding N.V. (NASDAQ:ASML) is one of the best Strong Buy stocks on this list. TheFly reported on May 20 that UB,"ASML Holding N.V. (ASML) Stock Gains Attention After UBS Lifts Price Target to €1,900",우리는 최근 지금 투자 할 12 가지 최고의 강력한 구매 기술 주식 목록을 작성했습니다. ASML Holding N.V. (NASDAQ: ASML) 는 이 목록에서 최고의 Strong Buy 주식 중 하나입니다. TheFly는 5월 20일 UB,Yahoo,https://finnhub.io/api/news?id=81bceb10e63fe9327dce93d07854ce97c2c67a5deec91d68077b052dd8e3efd3,1779967929,,ASML,ASML
미국주식,Is the AI Trade Entering Its Second Wave? This ETF Could Be a Major Beneficiary.,The artificial intelligence (AI) revolution has expanded to include many tech companies. But the industry's leaders are likely to drive growth over the next several years.,AI 거래가 두 번째 물결로 접어들고 있습니까? 이 ETF는 주요 수익자가 될 수 있습니다.,인공지능 (AI) 혁명은 많은 기술 기업으로 확대되었다. 그러나 업계 리더들은 향후 몇 년 동안 성장을 주도할 것으로 보입니다.,Yahoo,https://finnhub.io/api/news?id=3ac878f8d0d0cefc4b33574b6c35c13340e25a8ca04e75c8c0a0e8a258288c5c,1779969000,,ASML,ASML
미국주식,Stocks Rebound Amid News of a US-Iran Deal,"The S&P 500 Index ($SPX ) (SPY ) today is up +0.44%, the Dow Jones Industrial Average ($DOWI ) (DIA ) is up +0.01%, and the Nasdaq 100 Index ($IUXX ) (QQQ ) is up +0.62%. June E-mini S&P futures (ESM2",미국-이란 거래 소식에 반등한 주식,"현재 S&P 500 지수 ($ SPX) (SPY) 는 +0.44%, 다우존스 산업평균지수 ($ DOWI) (DIA) 는 +0.01%, 나스닥 100 지수 ($ IUXX) (QQQ) 는 +0.62% 상승했습니다. 6월 E-mini S&P 선물 (ESM2",Yahoo,https://finnhub.io/api/news?id=f49c25e4f6079d988d6835c001c3a53462691d731007d85e8a40faeaa25ffc86,1779982083,,ASML,ASML
미국주식,"""Nikon CEO Says Co To Take On ASML With Low-Priced Chipmaking Equipment; Japanese Company Looks To Diversify Away From Reliance On Intel Orders"" - Nikkei Asia",https://asia.nikkei.com/business/tech/semiconductors/nikon-to-take-on-asml-with-low-priced-chipmaking-equipment-ceo,"""Nikon CEO, 저렴한 칩 제조 장비로 ASML을 인수하겠다고 말하다; 일본 회사는 Intel 주문에 대한 의존에서 벗어나 다각화 할 것으로 보인다"" - Nikkei Asia",https://asia.nikkei.com/business/tech/semiconductors/nikon-to-take-on-asml-with-low-priced-chipmaking-equipment-ceo,Benzinga,https://finnhub.io/api/news?id=b24a7edbca70e77842d4c6cd70fcbca72b82bf182f8e6a64b51c39afa372c1d7,1779983437,,ASML,ASML
미국주식,Are You Looking for a Top Momentum Pick? Why ASML (ASML) is a Great Choice,Does ASML (ASML) have what it takes to be a top stock pick for momentum investors? Let's find out.,최고의 모멘텀 픽을 찾고 계십니까? ASML (ASML) 이 좋은 선택인 이유,ASML (ASML) 이 모멘텀 투자자에게 최고의 주식 선택이 되기 위해 필요한 것을 가지고 있습니까? 알아보겠습니다.,Yahoo,https://finnhub.io/api/news?id=679f67ecefa53cdf072a5f6cdddcd30a94d50bf017ee35f52211c581d45ebfb3,1779984006,,ASML,ASML
미국주식,ASML vs. KLAC: Which Semiconductor Equipment Stock Is the Better Buy?,"ASML has the edge over KLAC in terms of EUV leadership, a strong backlog, AI-chip tailwinds and a cheaper valuation.",ASML vs. KLAC: 어떤 반도체 장비 재고가 더 나은 구매입니까?,"ASML은 EUV 리더십, 강력한 백로그, AI 칩 순풍 및 저렴한 평가 측면에서 KLAC보다 우위를 점하고 있습니다.",Yahoo,https://finnhub.io/api/news?id=579b937487a5f0a38ce45ae681c69fd78fffe17c9387f66e1c0675dc6464a00c,1779987540,,ASML,ASML
미국주식,The AI Memory Shortage Is Just Getting Started and These 3 ETFs Own Every Layer of the Supply Chain,"High-bandwidth memory has become the choke point in the AI buildout, as NVIDIA’s Blackwell accelerators rely on stacked DRAM modules that only three companies can produce at scale, and the order books",AI 메모리 부족은 이제 막 시작되었으며 이 3가지 ETF는 공급망의 모든 계층을 소유하고 있습니다.,NVIDIA의 Blackwell 가속기는 3개 회사만 대규모로 생산할 수 있는 스택형 DRAM 모듈에 의존하기 때문에 고대역폭 메모리는 AI 빌드아웃에서 초크 포인트가 되었습니다.,Yahoo,https://finnhub.io/api/news?id=d00434aed958242404c09ddfad221a25bdd154cee49615f9b5cca52b3496ef0f,1780004889,,ASML,ASML
미국주식,​ ASML Holding N.V. (ASML) Sets Sights on India’s Foundry Opportunities amid Tata Electronics Pact,"ASML Holding N.V. (NASDAQ:ASML) is one of the best 52-week high stocks to invest in, according to short sellers. On May 16, ASML Holding N.V. (NASDAQ:ASML) entered into a strategic partnership with Ta",​ ASML 홀딩 N.V. (ASML) 는 타타 전자 조약에 따라 인도의 파운드리 기회를 조망합니다.,"ASML Holding N.V. (NASDAQ: ASML) 는 공매도에 따르면 투자하기 가장 좋은 52주 고액 주식 중 하나입니다. 5월 16일, ASML Holding N.V. (NASDAQ: ASML) 는 Ta와 전략적 파트너십을 체결했습니다.",Yahoo,https://finnhub.io/api/news?id=5921bd759b82e135603dbda31553e7b8d9863aa2579e4997f5622ce7873a3b8f,1780011652,,ASML,ASML
미국주식,Analysis-Huawei bets on speed over shrinking transistors to sidestep US chip sanctions,"Huawei's new chip design principle focused on boosting transmission speed rather than continuing to shrink semiconductors offers a path for China to build cutting-edge chips despite U.S. sanctions, th",Analysis-Huawei는 미국 칩 제재를 피하기 위해 트랜지스터 수축 속도에 베팅합니다.,반도체를 계속 축소하기보다는 전송 속도를 높이는 데 초점을 맞춘 화웨이의 새로운 칩 설계 원칙은 미국의 제재에도 불구하고 중국이 최첨단 칩을 구축할 수 있는 길을 제공합니다.,Yahoo,https://finnhub.io/api/news?id=3cf63e74825ea0d95ead1ad49bf5ddff4d27e72172cbe8f92115174107bb70c9,1780026143,,ASML,ASML
미국주식,After Three Years of Tracking the AI Capex Cycle These 3 Semiconductor ETFs Sit on Top of the Trade,"After three years of hyperscaler capital spending feeding through to chip designers, foundry capacity, and lithography backlogs, the semiconductor ETF complex has separated into distinct buckets. iSha",AI Capex 사이클을 3년간 추적한 후 이 3가지 반도체 ETF는 거래의 꼭대기에 있습니다.,"칩 설계자, 파운드리 생산 능력 및 리소그래피 잔고에 3 년간 하이퍼스케일러 자본을 투입한 후 반도체 ETF 복합체는 별개의 버킷으로 분리되었습니다. iSha",Yahoo,https://finnhub.io/api/news?id=103dbce23880754a63db2dabd6bd13f86af93b25f5e767093e181a0ffa01dbc9,1780063484,,ASML,ASML
미국주식,Stock Indexes Rally to Record Highs on Peace Deal Hopes and AI Spending,"The S&P 500 Index ($SPX ) (SPY ) today is up +0.41%, the Dow Jones Industrial Average ($DOWI ) (DIA ) is up +0.43%, and the Nasdaq 100 Index ($IUXX ) (QQQ ) is up +0.66%. June E-mini S&P futures (ESM2","주가지수 랠리, 평화협정과 AI 지출 사상 최고치 경신","현재 S&P 500 지수 ($ SPX) (SPY) 는 +0.41%, 다우존스 산업평균지수 ($ DOWI) (DIA) 는 +0.43%, 나스닥 100 지수 ($ IUXX) (QQQ) 는 +0.66% 상승했습니다. 6월 E-mini S&P 선물 (ESM2",Yahoo,https://finnhub.io/api/news?id=8be2514eb660a28e81ea4f5414ee09a5bad1bbe7b8b5d24b432167592351d75a,1780063545,,ASML,ASML
미국주식,SCHD’s $85 Billion Strategy Now Concentrates 41 Percent of Your Money in Just Ten Stocks,"A 63-year-old retiree with $400,000 parked in the Schwab U.S. Dividend Equity ETF (NYSEARCA:SCHD) likely picked it for the 100-stock screen and the reliable income stream. The top 10 positions now mak",SCHD’s $85 Billion Strategy Now Concentrates 41 Percent of Your Money in Just Ten Stocks,"A 63-year-old retiree with $400,000 parked in the Schwab U.S. Dividend Equity ETF (NYSEARCA:SCHD) likely picked it for the 100-stock screen and the reliable income stream. The top 10 positions now mak",Yahoo,https://finnhub.io/api/news?id=79c050f23c7fb3093430c6abe9673755fcd798d82dc4d003d63188545ab73bce,1780762305,,ABBV,ABBV
미국주식,AbbVie (ABBV) Valuation Check After New Cancer And Migraine Drug Approvals,"AbbVie (ABBV) is back in focus after a cluster of regulatory decisions, including FDA approval of DECNUPAZ for a rare blood cancer and European green lights for AQUIPTA and new VENCLYXTO combinations.",AbbVie (ABBV) Valuation Check After New Cancer And Migraine Drug Approvals,"AbbVie (ABBV) is back in focus after a cluster of regulatory decisions, including FDA approval of DECNUPAZ for a rare blood cancer and European green lights for AQUIPTA and new VENCLYXTO combinations.",Yahoo,https://finnhub.io/api/news?id=26f32fb9eaf78a9713599bae648be002924d56d2d2f1395b80c5ffbaca99440a,1780769845,,ABBV,ABBV
미국주식,Forget Wall Street’s Ultimate Pharma Value Trap: Here Is a Far Better Stock to Buy Right Now,"Bristol Myers Squibb (NYSE:BMY) is the headline pharma name dividend hunters keep circling, drawn in by a 4.37% yield and a forward P/E of 9 that screams cheap. But the underlying numbers tell a diffe",Forget Wall Street’s Ultimate Pharma Value Trap: Here Is a Far Better Stock to Buy Right Now,"Bristol Myers Squibb (NYSE:BMY) is the headline pharma name dividend hunters keep circling, drawn in by a 4.37% yield and a forward P/E of 9 that screams cheap. But the underlying numbers tell a diffe",Yahoo,https://finnhub.io/api/news?id=d59a0637c6879eb1f9e905d5f13b3c0c9bc5280ca48a823426e66702a8a8a296,1780841614,,ABBV,ABBV
미국주식,Is AbbVie the Most Underrated Dividend Growth Stock in the S&P 500?,"For a solid yield and strong upside potential, this pharmaceutical stock is worth considering.",Is AbbVie the Most Underrated Dividend Growth Stock in the S&P 500?,"For a solid yield and strong upside potential, this pharmaceutical stock is worth considering.",Yahoo,https://finnhub.io/api/news?id=9623943ac9bb10789d0f3959dbc2b30901b1fbbb2aa0a9cff49089f0d8e7c8ff,1780898700,,ABBV,ABBV
