시장,제목,3줄요약,제목_한글,요약_한글,출처,URL,게시시간,다음행동,종목코드,종목명
미국주식,Is It Time to Buy Latin America's Top Fintech Stocks at a Discount?,"Earnings season didn't go well for MercadoLibre, DLocal, and Nu Holdings. This could be a good time to be opportunistic.",Is It Time to Buy Latin America's Top Fintech Stocks at a Discount?,"Earnings season didn't go well for MercadoLibre, DLocal, and Nu Holdings. This could be a good time to be opportunistic.",Yahoo,https://finnhub.io/api/news?id=75bb0684fd1d26ebdbefbcec2ffe4cc7eb5c73694591b85ecaacfe1de0e4d74f,1779019020,,MELI,MELI
미국주식,The Top 5 Analyst Questions From MercadoLibre’s Q1 Earnings Call,"MercadoLibre’s first quarter was defined by rapid revenue growth and deliberate margin compression, prompting a negative market reaction. Management attributed the 49% year-over-year sales surge to su",The Top 5 Analyst Questions From MercadoLibre’s Q1 Earnings Call,"MercadoLibre’s first quarter was defined by rapid revenue growth and deliberate margin compression, prompting a negative market reaction. Management attributed the 49% year-over-year sales surge to su",Yahoo,https://finnhub.io/api/news?id=ff8b2206c4fc8aa0fb5f5d622bfbf439857aaaf6f7f95c1ed85fcda4c15452cb,1779102535,,MELI,MELI
미국주식,Three Companies Priced Below Estimated Value In May 2026,"In the last week, the market has stayed flat, yet it is up 24% over the past year with earnings forecasted to grow by 17% annually. In such a vibrant market environment, identifying undervalued stocks",Three Companies Priced Below Estimated Value In May 2026,"In the last week, the market has stayed flat, yet it is up 24% over the past year with earnings forecasted to grow by 17% annually. In such a vibrant market environment, identifying undervalued stocks",Yahoo,https://finnhub.io/api/news?id=b3b134148359e0837cf6a6e3465e8439280d31312fdee3190b0c6d4678ce344d,1779104278,,MELI,MELI
미국주식,Alibaba: Now An AI Growth Stock,"Alibaba Group Holding Limited Q4 shows surging Cloud & AI growth, a cheap 14.4x forward P/E, and a $56B capex push. Click for this BABA earnings update.",Alibaba: Now An AI Growth Stock,"Alibaba Group Holding Limited Q4 shows surging Cloud & AI growth, a cheap 14.4x forward P/E, and a $56B capex push. Click for this BABA earnings update.",SeekingAlpha,https://finnhub.io/api/news?id=9085d4e5601a647611f674cbce42f44ee29547b520bb0e43bc7bf27db1c19108,1779110317,,MELI,MELI
미국주식,3 Stocks That May Be Priced Below Their Estimated Value In May 2026,"The United States market has remained flat over the last week, yet it has experienced a 24% rise over the past 12 months with earnings forecast to grow by 17% annually. In such an environment, identif",3 Stocks That May Be Priced Below Their Estimated Value In May 2026,"The United States market has remained flat over the last week, yet it has experienced a 24% rise over the past 12 months with earnings forecast to grow by 17% annually. In such an environment, identif",Yahoo,https://finnhub.io/api/news?id=9c91292c10c9b37c20d1f0e36c9f59761fedf6ffdb7dafed61322c4107986bd8,1779125883,,MELI,MELI
미국주식,"This Stock Is Known as the ""Amazon of Latin America,"" and It's Trading Near Its 52-Week Low","MercadoLibre's e-commerce business has been booming in recent years, and now, investors have the opportunity to buy the growth stock at a reduced price.","This Stock Is Known as the ""Amazon of Latin America,"" and It's Trading Near Its 52-Week Low","MercadoLibre's e-commerce business has been booming in recent years, and now, investors have the opportunity to buy the growth stock at a reduced price.",Yahoo,https://finnhub.io/api/news?id=c4549cd3a784c620ac1fa9ceff5debac65adde6056cdd3c0cd20b964ff70b177,1779200400,,MELI,MELI
미국주식,3 Reasons to Buy MercadoLibre Stock on the Dip,The market's skepticism may be creating an attractive entry point.,3 Reasons to Buy MercadoLibre Stock on the Dip,The market's skepticism may be creating an attractive entry point.,Yahoo,https://finnhub.io/api/news?id=57820ad229fd4f65fbcad8c8d772cde768ad74789d5b34380f688744b841bda0,1779213000,,MELI,MELI
미국주식,Hedge Fund Bienville Capital Exited Its Position in Monday.com Stock. Here's What That Means for Investors.,"Monday.com Ltd. provides cloud-based software for project, CRM, and workflow management to organizations around the globe.",Hedge Fund Bienville Capital Exited Its Position in Monday.com Stock. Here's What That Means for Investors.,"Monday.com Ltd. provides cloud-based software for project, CRM, and workflow management to organizations around the globe.",Yahoo,https://finnhub.io/api/news?id=cfc0f8bc842f5fc27827dd81ed8fe3da0d19ae18f5590b7a9f5605dd2fa52a1e,1779289681,,MELI,MELI
미국주식,Tracking Al Gore's Generation Investment Management Portfolio - Q1 2026 Update,"Generation IM Q1 2026 13F: portfolio drops to $11.16B; top holdings MSFT, AMZN & GOOGL; big buys/sells and new picks.",Tracking Al Gore's Generation Investment Management Portfolio - Q1 2026 Update,"Generation IM Q1 2026 13F: portfolio drops to $11.16B; top holdings MSFT, AMZN & GOOGL; big buys/sells and new picks.",SeekingAlpha,https://finnhub.io/api/news?id=c0b93672884a9c8d577303f3b7b5d775d80b9cd1e6d5186b2a7797cc952e220f,1779309127,,MELI,MELI
미국주식,"Michael Burry buys beaten-down, forgotten fintech stock","While the rest of the market has been chasing AI, Michael Burry spent his Monday evening on Substack explaining why he has been buying the stocks everyone else is ignoring. He has a name for what he i","Michael Burry buys beaten-down, forgotten fintech stock","While the rest of the market has been chasing AI, Michael Burry spent his Monday evening on Substack explaining why he has been buying the stocks everyone else is ignoring. He has a name for what he i",Yahoo,https://finnhub.io/api/news?id=acbeb4c7dfcd5bbb2df60c091bd98096266560a18bbfdda76ef1f8dff6ebf99e,1779330780,,MELI,MELI
미국주식,What Offers Mercado Libre (MELI) a Longer Runway for Extraordinary Growth?,"Eagle Capital Management, an investment management company, released its first quarter 2026 investor letter. A copy of the letter is available to download here. The letter notes that individual stocks",What Offers Mercado Libre (MELI) a Longer Runway for Extraordinary Growth?,"Eagle Capital Management, an investment management company, released its first quarter 2026 investor letter. A copy of the letter is available to download here. The letter notes that individual stocks",Yahoo,https://finnhub.io/api/news?id=aa9d2f0c3a335c6d31222dc0ba27f6a0e26bb67f6fb4640f0a76b3ddd3c2cc55,1779370244,,MELI,MELI
미국주식,Mercado Libre: Love And Hate,Mercado Libre stock fell after earnings on margin compression and lower EPS.,Mercado Libre: Love And Hate,Mercado Libre stock fell after earnings on margin compression and lower EPS.,SeekingAlpha,https://finnhub.io/api/news?id=fa4a7fd00238002dffd96318ea03885972422554739c192b4aeb52519af13a65,1779441093,,MELI,MELI
미국주식,"Mexico Social Commerce Intelligence Report 2026: A $96.95 Billion Market by 2031 - Meta, Amazon and Mercado Libre Continue to Shape Conversion Dynamics, New Entrants Expand Through TikTok","Mexico's social commerce market is poised for growth with trends like in-stream checkouts on platforms like TikTok Shop, enhanced WhatsApp-assisted selling, and integration into major retail events. B","Mexico Social Commerce Intelligence Report 2026: A $96.95 Billion Market by 2031 - Meta, Amazon and Mercado Libre Continue to Shape Conversion Dynamics, New Entrants Expand Through TikTok","Mexico's social commerce market is poised for growth with trends like in-stream checkouts on platforms like TikTok Shop, enhanced WhatsApp-assisted selling, and integration into major retail events. B",Yahoo,https://finnhub.io/api/news?id=298dd7975bc3ecd757187f219eaedf36659309380757aa6791bd61c362702831,1779445320,,MELI,MELI
미국주식,"Will GE Vernova, MercadoLibre, or NVR Be the Next Big Stock Split?","Wall Street is rediscovering the stock split playbook. In May 2026, KLA (NASDAQ: KLAC) announced a 10-for-1 forward stock split alongside a fiscal Q3 earnings beat and a roughly 21% dividend hike, wit","Will GE Vernova, MercadoLibre, or NVR Be the Next Big Stock Split?","Wall Street is rediscovering the stock split playbook. In May 2026, KLA (NASDAQ: KLAC) announced a 10-for-1 forward stock split alongside a fiscal Q3 earnings beat and a roughly 21% dividend hike, wit",Yahoo,https://finnhub.io/api/news?id=2900f20d30b29f1f27ded6485735cfb294beab8c49207bce91dd3ee8affe88cf,1779455407,,MELI,MELI
미국주식,"The Best Stocks to Invest $5,000 In Right Now","While the market is reaching new highs, look for bargains and safe stocks.","The Best Stocks to Invest $5,000 In Right Now","While the market is reaching new highs, look for bargains and safe stocks.",Yahoo,https://finnhub.io/api/news?id=d5593c331030e5d9148ed49452b25cbf0b404a32c5fda73d596a11abdf507864,1779482460,,MELI,MELI
미국주식,Is Now the Time to Buy MercadoLibre Stock After Hedge Fund Linonia Initiated a Position Worth Over $225 Million?,MercadoLibre operates a leading e-commerce and fintech platform serving businesses and consumers across Latin America.,Is Now the Time to Buy MercadoLibre Stock After Hedge Fund Linonia Initiated a Position Worth Over $225 Million?,MercadoLibre operates a leading e-commerce and fintech platform serving businesses and consumers across Latin America.,Yahoo,https://finnhub.io/api/news?id=c8d0f56b1a108451ee82d4c0787a5d22b3e841fd1d6ffe735f65b9828859ee84,1779602273,,MELI,MELI
미국주식,MercadoLibre (MELI) Releases Financial Results for Q1 2026,"MercadoLibre, Inc. (NASDAQ:MELI) is one of the Best Long-Term Stocks to Buy Now for High Returns. On May 7, the company released its financial results for Q1 2026, with net revenues & financial income",MercadoLibre (MELI) Releases Financial Results for Q1 2026,"MercadoLibre, Inc. (NASDAQ:MELI) is one of the Best Long-Term Stocks to Buy Now for High Returns. On May 7, the company released its financial results for Q1 2026, with net revenues & financial income",Yahoo,https://finnhub.io/api/news?id=a7e093a11a45df9e00b6c077bf781202665346a77b32192bba0b42c0d7b18642,1779629460,,MELI,MELI
미국주식,Hedge Funds Back MercadoLibre Reinvestment As Fintech And Logistics Expand,"Large hedge funds, including Linonia Partnership LP, have recently built significant positions in MercadoLibre (NasdaqGS:MELI). Michael Burry's Scion Asset Management has also initiated or expanded a ",Hedge Funds Back MercadoLibre Reinvestment As Fintech And Logistics Expand,"Large hedge funds, including Linonia Partnership LP, have recently built significant positions in MercadoLibre (NasdaqGS:MELI). Michael Burry's Scion Asset Management has also initiated or expanded a",Yahoo,https://finnhub.io/api/news?id=987d142586a09c3e0f381d3c0d4302bc89dafa7091b86d5d0108a52fd0424037,1779660688,,MELI,MELI
미국주식,Mastercard BitLicense Approval Opens New Chapter In Digital Assets And Valuation,Mastercard (NYSE:MA) has received a BitLicense from New York State. The approval allows the company to engage in regulated digital asset and crypto activities under New York's rules. The BitLicense is,Mastercard BitLicense Approval Opens New Chapter In Digital Assets And Valuation,Mastercard (NYSE:MA) has received a BitLicense from New York State. The approval allows the company to engage in regulated digital asset and crypto activities under New York's rules. The BitLicense is,Yahoo,https://finnhub.io/api/news?id=60b1f67813eefb9ee299c2f725f274cbb154c97a69ead4e3441e69f8d87838fe,1779966350,,MA,MA
미국주식,Mastercard: From Burn Scar to Blueprint for Rebirth: How This Canadian Forest Is Being Rebuilt,"On First Nations land ravaged by wildfires, 400,000 seedlings are placed in protective microsites, timed to snowmelt moisture, and carefully monitored to improve survival in hot, dry country. By Diann",Mastercard: From Burn Scar to Blueprint for Rebirth: How This Canadian Forest Is Being Rebuilt,"On First Nations land ravaged by wildfires, 400,000 seedlings are placed in protective microsites, timed to snowmelt moisture, and carefully monitored to improve survival in hot, dry country. By Diann",Yahoo,https://finnhub.io/api/news?id=8080c142fcc89898686cdb044570c07b9c47e1e86dc7b4b04ed36476d0dd95c8,1779971400,,MA,MA
미국주식,Can Visa's New AR Integration Accelerate Virtual Card Adoption?,V expands its commercial payments push with AI-driven AR tools that simplify virtual card adoption.,Can Visa's New AR Integration Accelerate Virtual Card Adoption?,V expands its commercial payments push with AI-driven AR tools that simplify virtual card adoption.,Yahoo,https://finnhub.io/api/news?id=b506443179544cf808e43b202c89cdbfc9ba16ee3011f0c63ea2919dbb5de576,1779975540,,MA,MA
미국주식,2 Oversold Stocks Primed to Rebound and 1 We Avoid,"Rock-bottom prices don’t always mean rock-bottom businesses. The stocks we’re examining today have all touched their 52-week lows, creating a classic investor’s dilemma: bargain opportunity or value t",2 Oversold Stocks Primed to Rebound and 1 We Avoid,"Rock-bottom prices don’t always mean rock-bottom businesses. The stocks we’re examining today have all touched their 52-week lows, creating a classic investor’s dilemma: bargain opportunity or value t",Yahoo,https://finnhub.io/api/news?id=f196f6d80f880e8a734950b0d44462b1f19d09fb4186d468a4da9a0a0f82dfb1,1779976227,,MA,MA
미국주식,"Mythos was the critical trigger for IBM's open-source cybersecurity push, Krishna says","IBM has signed Goldman Sachs, Morgan Stanley, JPMorgan and Bank of America onto its open-source cybersecurity effort called Project Lightwell.","Mythos was the critical trigger for IBM's open-source cybersecurity push, Krishna says","IBM has signed Goldman Sachs, Morgan Stanley, JPMorgan and Bank of America onto its open-source cybersecurity effort called Project Lightwell.",CNBC,https://finnhub.io/api/news?id=097e6cc4d59301bbb075d7d11ee4ebd04f5da79749f22d1b95a81a2ee950db1d,1779976963,,MA,MA
미국주식,Paxos Wins SEC Clearing Agency Approval for Blockchain Settlement Business,"Paxos has secured a U.S. market-structure approval for its blockchain settlement business, giving one of crypto&rsq...",Paxos Wins SEC Clearing Agency Approval for Blockchain Settlement Business,"Paxos has secured a U.S. market-structure approval for its blockchain settlement business, giving one of crypto&rsq...",Yahoo,https://finnhub.io/api/news?id=a5ac93080fea34683fa61a4f7e329fc5ebefcb760b6b92f3d7f7ded71daff7b1,1779977160,,MA,MA
미국주식,IBM Red Hat Project Lightwell $5 billion open-source security,"Project Lightwell will deploy more than 20,000 engineers and AI tools to identify and fix vulnerabilities across enterprise software supply chains",IBM Red Hat Project Lightwell $5 billion open-source security,"Project Lightwell will deploy more than 20,000 engineers and AI tools to identify and fix vulnerabilities across enterprise software supply chains",Yahoo,https://finnhub.io/api/news?id=0c39a82c4c26775a6989092a2ab623c79fd1605dc59ce6dfdf0ad5d57268bcd8,1779977383,,MA,MA
미국주식,What Mastercard's BitLicense Means for Its Digital Payments Future,MA's BitLicense win strengthens its push into stablecoins and blockchain-based payments infrastructure.,What Mastercard's BitLicense Means for Its Digital Payments Future,MA's BitLicense win strengthens its push into stablecoins and blockchain-based payments infrastructure.,Yahoo,https://finnhub.io/api/news?id=98bf115c393244bc1903521510b575fd74431ebd5143c90c6825484b16513908,1779984000,,MA,MA
미국주식,"How Mastercard, SoFi, Block are heating up the stablecoin battle","Scott Melker discusses the latest push by big banks, including Mastercard (MA), SoFi (SOFI), and Block (XYZ), in the stablecoin arms race, which is accelerating quickly. ""The Daily Wolf with Scott Mel","How Mastercard, SoFi, Block are heating up the stablecoin battle","Scott Melker discusses the latest push by big banks, including Mastercard (MA), SoFi (SOFI), and Block (XYZ), in the stablecoin arms race, which is accelerating quickly. ""The Daily Wolf with Scott Mel",Yahoo,https://finnhub.io/api/news?id=1c29d8361bd2766b269cb60107fa1319fd4468dd63ca4b38ea75993fc447a503,1779985200,,MA,MA
미국주식,Traditional banks take the lead in the stablecoin arms race,"Scott Melker discusses the stablecoin market seeing traditional banks take the lead, $114T in assets to be tokenized on Stellar network by DTCC, and other big crypto headlines of the day. ""The Daily W",Traditional banks take the lead in the stablecoin arms race,"Scott Melker discusses the stablecoin market seeing traditional banks take the lead, $114T in assets to be tokenized on Stellar network by DTCC, and other big crypto headlines of the day. ""The Daily W",Yahoo,https://finnhub.io/api/news?id=3ade96aa5a578565e5db35a9786dc908852e817a610afcfd56c286616bf28336,1779985325,,MA,MA
미국주식,Mastercard: The Perfect Hedge Against Currency Debasement And Inflation,Mastercard stock is down ~18% from its all-time high and is now trading at a reasonable 21.7x 2027 earnings. Read more on MA stock here.,Mastercard: The Perfect Hedge Against Currency Debasement And Inflation,Mastercard stock is down ~18% from its all-time high and is now trading at a reasonable 21.7x 2027 earnings. Read more on MA stock here.,SeekingAlpha,https://finnhub.io/api/news?id=4caed34fc2cbd2d6abab8996ca5d0f970ffb09c0b6e785d39fa8cad8435087d5,1779990152,,MA,MA
미국주식,Mastercard Incorporated (MA) Presents at Bernstein 42nd Annual Strategic Decisions Conference Transcript,"Mastercard Incorporated (MA) Bernstein 42nd Annual Strategic Decisions Conference May 28, 2026 2:30 PM EDTCompany ParticipantsMichael Miebach - CEO,...",Mastercard Incorporated (MA) Presents at Bernstein 42nd Annual Strategic Decisions Conference Transcript,"Mastercard Incorporated (MA) Bernstein 42nd Annual Strategic Decisions Conference May 28, 2026 2:30 PM EDTCompany ParticipantsMichael Miebach - CEO,...",SeekingAlpha,https://finnhub.io/api/news?id=bc14e1b4a2b8ee50e55c27a507580758baf74fdbcb38cf87321761283236cf04,1779990846,,MA,MA
미국주식,Mastercard (MA) Valuation Check After Recent Pullback And Premium P/E Multiple,"Mastercard stock snapshot Mastercard (MA) is back on many watchlists after a recent pullback, with the stock down about 2% over the past month and roughly 12% year to date based on the latest closing ",Mastercard (MA) Valuation Check After Recent Pullback And Premium P/E Multiple,"Mastercard stock snapshot Mastercard (MA) is back on many watchlists after a recent pullback, with the stock down about 2% over the past month and roughly 12% year to date based on the latest closing",Yahoo,https://finnhub.io/api/news?id=04ce916a81efadf49aca9c4fdcd464a62fd3190ecf5393b218e6ba9ff4556ecc,1780002610,,MA,MA
미국주식,Is Visa Stock Underperforming the Nasdaq?,"Though Visa has lagged behind the broader Nasdaq Composite over the past year, Wall Street analysts remain strongly optimistic about the stock’s prospects.",Is Visa Stock Underperforming the Nasdaq?,"Though Visa has lagged behind the broader Nasdaq Composite over the past year, Wall Street analysts remain strongly optimistic about the stock’s prospects.",Yahoo,https://finnhub.io/api/news?id=fb7eebf36b59205ef99ea0710c109f2f35dff19959e5c2a7c8a73b41784ee837,1780021713,,MA,MA
미국주식,How Is Mastercard's Stock Performance Compared to Other FinTech Stocks?,"Although Mastercard has underperformed its industry peers recently, analysts remain highly optimistic about the stock’s prospects.",How Is Mastercard's Stock Performance Compared to Other FinTech Stocks?,"Although Mastercard has underperformed its industry peers recently, analysts remain highly optimistic about the stock’s prospects.",Yahoo,https://finnhub.io/api/news?id=b5b53a9650d2f04f9f1b6c08eb25d7fdb46124d3357f1645bcb2886fb7b641a4,1780027530,,MA,MA
미국주식,AI-driven scam stores put retailers on alert,"AI-generated scam stores are becoming harder to detect as fraudsters use fake reviews, deepfakes and convincing ecommerce websites to target online shoppers.",AI-driven scam stores put retailers on alert,"AI-generated scam stores are becoming harder to detect as fraudsters use fake reviews, deepfakes and convincing ecommerce websites to target online shoppers.",Yahoo,https://finnhub.io/api/news?id=8e3fb1f16bc3c24658c8f2134d870c464727b30acc90bbddf219d75678841e3b,1780045444,,MA,MA
미국주식,"Whale's Insight: Crypto Trades Stocks, Banks Issue Stablecoins - Why CRCL Fell 30%","SoFi launched a national-bank stablecoin on May 27, joining JPMorgan, Mastercard/BVNK and Tether USAT on the GENIUS Act lane in four months. Read more here.","Whale's Insight: Crypto Trades Stocks, Banks Issue Stablecoins - Why CRCL Fell 30%","SoFi launched a national-bank stablecoin on May 27, joining JPMorgan, Mastercard/BVNK and Tether USAT on the GENIUS Act lane in four months. Read more here.",SeekingAlpha,https://finnhub.io/api/news?id=f0f32fff978b53a20bf04cf6a3c0056d83aa94dfeb9ea096cb939fbba85bf0dd,1780050600,,MA,MA
미국주식,"SoFi Technologies Surges 12% on Stablecoin Launch; Robinhood, Upstart Extend Fintech Bounce","SoFi Technologies (NASDAQ:SOFI) stock is ripping in early Friday trading, up 12% to around $19, as investors react to the company’s push into bank-issued stablecoins. The pop builds on a fintech bounc","SoFi Technologies Surges 12% on Stablecoin Launch; Robinhood, Upstart Extend Fintech Bounce","SoFi Technologies (NASDAQ:SOFI) stock is ripping in early Friday trading, up 12% to around $19, as investors react to the company’s push into bank-issued stablecoins. The pop builds on a fintech bounc",Yahoo,https://finnhub.io/api/news?id=1b905f942a1207fd29d7491fd38126d806840be766c3d0d2f0e036d3c75c65b1,1780060999,,MA,MA
미국주식,Payments Stocks in the Stablecoin Era: 3 to Buy and 1 to Avoid,"The credit card leaders will be fine, but the digital payments leader could be in trouble.",Payments Stocks in the Stablecoin Era: 3 to Buy and 1 to Avoid,"The credit card leaders will be fine, but the digital payments leader could be in trouble.",Yahoo,https://finnhub.io/api/news?id=c32d71e73d7bd802033c9819fcafc44301817896c98a05aeb24d4c82c4a786d2,1780076400,,MA,MA
미국주식,"Crypto Card Payment Volumes More Than Double In A Year, Growth Surges Since Stablecoin Act Passage","Market commentator The Kobeissi Letter spotlighted on Wednesday a sharp spike in cryptocurrency card payments, linking it to increased stablecoin adoption. Cumulative Card Volume Nearing $8 Billion Ko","Crypto Card Payment Volumes More Than Double In A Year, Growth Surges Since Stablecoin Act Passage","Market commentator The Kobeissi Letter spotlighted on Wednesday a sharp spike in cryptocurrency card payments, linking it to increased stablecoin adoption. Cumulative Card Volume Nearing $8 Billion Ko",Yahoo,https://finnhub.io/api/news?id=9b17c9d071a60dfd818ba6f6806caa464c563827c243ebb8b7f902740b6fa2e7,1780083064,,MA,MA
미국주식,"EXCLUSIVE: Tesla Isn't On The Same Playing Field As Waymo, Expert Says—Predicts Chinese Manufacturers Entering The U.S. Is 'Inevitable'",While Waymo dominates the U.S. Robotaxis and Tesla lags behind. Uber&#39;s reach and partnerships could make it an orchestrator in the sector.,"EXCLUSIVE: Tesla Isn't On The Same Playing Field As Waymo, Expert Says—Predicts Chinese Manufacturers Entering The U.S. Is 'Inevitable'",While Waymo dominates the U.S. Robotaxis and Tesla lags behind. Uber&#39;s reach and partnerships could make it an orchestrator in the sector.,Benzinga,https://finnhub.io/api/news?id=e0ed2b11c5de208c57b653fd30c10bab682df0047b444e16b20ddebfe6ae0fca,1779013963,,LYFT,LYFT
미국주식,"Dave Ramsey Tells Man, 29, Who Spent $144K On Cars To Drive For Uber 'You've Been Working For Free' — Now He's Asking If A Voluntary Repo Is Smart","A San Francisco Uber driver thought bigger vehicles would lead to bigger paydays. Instead, the strategy left him buried under two car loans, falling behind on payments and asking personal finance expe","Dave Ramsey Tells Man, 29, Who Spent $144K On Cars To Drive For Uber 'You've Been Working For Free' — Now He's Asking If A Voluntary Repo Is Smart","A San Francisco Uber driver thought bigger vehicles would lead to bigger paydays. Instead, the strategy left him buried under two car loans, falling behind on payments and asking personal finance expe",Yahoo,https://finnhub.io/api/news?id=96a6c6b64b264a19c67f23d2e400f94379db34196ebd16fadea4020496d31430,1779021087,,LYFT,LYFT
미국주식,Here is why Lyft (LYFT) is One of the Best Low Priced Tech Stocks to Buy According to Hedge Funds,"Lyft Inc. (NASDAQ:LYFT) is one of the best low priced technology stocks to buy according to hedge funds. On May 7, Lyft reported financial results for Q1 2026. Gross Bookings reached $4.9 billion, a 1",Here is why Lyft (LYFT) is One of the Best Low Priced Tech Stocks to Buy According to Hedge Funds,"Lyft Inc. (NASDAQ:LYFT) is one of the best low priced technology stocks to buy according to hedge funds. On May 7, Lyft reported financial results for Q1 2026. Gross Bookings reached $4.9 billion, a 1",Yahoo,https://finnhub.io/api/news?id=5c6ad3a58ae81bc21179e0c82711a71bca45ab30c1e2ea61028f56bc3bf41e09,1779078815,,LYFT,LYFT
미국주식,"DA Davidson Maintains Neutral on Lyft, Lowers Price Target to $14.5",DA Davidson  analyst Tom White   maintains Lyft (NASDAQ:LYFT) with a Neutral and lowers the price target from $19 to $14.5.,"DA Davidson Maintains Neutral on Lyft, Lowers Price Target to $14.5",DA Davidson  analyst Tom White   maintains Lyft (NASDAQ:LYFT) with a Neutral and lowers the price target from $19 to $14.5.,Benzinga,https://finnhub.io/api/news?id=7818ff445f955bd460f6bd27b2454025c225ad81ba18ed8ab9728cb9c5b6bd8c,1779103099,,LYFT,LYFT
