시장,제목,3줄요약,출처,URL,게시시간,다음행동,종목코드,종목명
미국주식,Satellogic Hires Senior Defense & Intelligence Veterans As Demand Grows,"By Karen Roman Geospatial company Satellogic Inc. (Nasdaq: SATL) said it recruited senior industry veterans Matt Clark, Brett Davis, and Jonathan Lee, to meet the increasing demand for continuous, glo",Yahoo,https://finnhub.io/api/news?id=1ee62dc4cf90df9f3ae1b6ffb26bd912ae32dbeffaed4079f036c5a71f04a757,1777910179,,ASTS,ASTS
미국주식,STMicro targets more than $3 billion in space chip revenue as demand grows,"STMicroelectronics is targeting well above $3 billion in cumulative revenue for its semiconductor space business from 2026 to ‌2028, it said on Monday, helped by surging demand for chips ‌used in low-",Yahoo,https://finnhub.io/api/news?id=6f2e061014c2dd246795a8eac7e76962cddbeb4401d77216f2983b9a141ff1ac,1777910488,,ASTS,ASTS
미국주식,"Here's Why AST SpaceMobile, Inc. (ASTS) Fell More Than Broader Market","The latest trading day saw AST SpaceMobile, Inc. (ASTS) settling at $68.31, representing a -3.64% change from its previous close.",Yahoo,https://finnhub.io/api/news?id=61164ad2ee8d683cbb14be9f665ec948eeb1016daab7ed13ae1a21dcf5e82dce,1777932003,,ASTS,ASTS
미국주식,Jeff Bezos' Blue Origin Blue Moon Mark 1 Lander Clears Key Space-Simulation Test As NASA Eyes Future Artemis Moon Landings,"Blue Origin&#39;s Blue Moon lander, Mark 1, passes NASA&#39;s survival test at Johnson Space Center. Scheduled to launch later this year.",Benzinga,https://finnhub.io/api/news?id=0c4caa90959e9d3a1ceb01be5982c42b08e297353ff30d54495bfaa89680247b,1777951592,,ASTS,ASTS
미국주식,AST SpaceMobile Shares Tumble: Did Execution Delays Kill The Rally?,AST SpaceMobile shares are trading lower Tuesday morning as investors digest fresh proxy disclosures that refocus attention on execution timing for its satellite-to-phone rollout.,Benzinga,https://finnhub.io/api/news?id=b07c7b8d889b6707d080c0ea764ea4ed4a90d3c6a6de9b4b9d7ca4398b9873d0,1777979206,,ASTS,ASTS
미국주식,3 Stocks With Estimated Discounts Up To 44.8% Offering Value Opportunities,"The United States market has remained flat over the last week but is up 28% over the past year, with earnings expected to grow by 16% per annum. In such a climate, identifying undervalued stocks that ",Yahoo,https://finnhub.io/api/news?id=67eec17be100d2e132e26b68683539af7547f149db21aa6cb4fd056eac822f86,1777981093,,ASTS,ASTS
미국주식,3 Stocks Estimated To Be Trading Up To 49.9% Below Intrinsic Value,"Over the last 7 days, the United States market has remained flat, yet it has seen a significant rise of 28% over the past year, with earnings projected to grow by 16% annually in the coming years. In ",Yahoo,https://finnhub.io/api/news?id=b52b6e6f0a81efadde65a7f5cab8ea3af51ea161404fca442be48679b172d4bf,1778002690,,ASTS,ASTS
미국주식,AST SpaceMobile Shares Rebound: What's Happening Today?,AST SpaceMobile Inc (NASDAQ: ASTS) shares are trading higher Wednesday as proxy disclosures refocus attention on rollout timing.,Benzinga,https://finnhub.io/api/news?id=7119ac8bbdce28f3b3a6992537892a110e07247ea09988d90a91f45ded818ae0,1778060808,,ASTS,ASTS
미국주식,"UFO, ROKT, and ARKX: Which Space ETF Fits Your Commercial Satellite Bet",The commercial space economy has shifted from a story about government contracts to one about private revenue. Satellite broadband and earth observation companies are signing recurring contracts with ,Yahoo,https://finnhub.io/api/news?id=b86070e4eafd47c0efaf820a5d6b9904bc1c4e8a305c48ae8ecf216d944afb85,1778077640,,ASTS,ASTS
미국주식,Zeo Energy Signs Memorandum Of Understanding With Creekstone Energy,,Benzinga,https://finnhub.io/api/news?id=728daee71c81deb6c38237776db2bd2e53c7990dd0ffbe00e3b9234ad63c131a,1771407346,,AVAV,AVAV
미국주식,"Shares of aerospace and defense companies are trading higher as investors respond to the US-Iran ceasefire deal and President Trump's 15‑point cooperation plan, easing geopolitical tensions and boosting risk appetite.",,Benzinga,https://finnhub.io/api/news?id=dd916a753d7e21383dc2a731d093722996975f9a0fe753eafc8360cc67abf150,1775661262,,AVAV,AVAV
미국주식,"Two More Stocks to Buy Immediately, According to AI","Tom Yeung here with your Sunday Digest. Last week here, I flagged three compelling companies to buy: Reddit Inc. (RDDT) Arm Holdings Plc (ARM) AeroVironment Inc. (AVAV) Our colleagues at TradeSmith ha",Yahoo,https://finnhub.io/api/news?id=9ac1ce8b8d94fae3c0d470d926cb4c367e1c3a8105c9940f526c5970301ddc87,1777219200,,AVAV,AVAV
미국주식,AeroVironment vs. Teledyne: Which Defense Tech Stock Is Better?,"AVAV and TDY expand unmanned and sensor-driven surveillance capabilities as defense demand climbs, putting both stocks in investors' sights.",Yahoo,https://finnhub.io/api/news?id=317aef6b0a0f47f9e50b3aa1e56ecdb6639464ee575545dcfa868b8e4aea73d3,1777294980,,AVAV,AVAV
미국주식,"AeroVironment : Press space to expand and collapse this section AV Announces Halo Shield™, Comprehensive Tile-Based C-UAS Solution","Apr. 28, 2026-- AeroVironment, Inc. , a global leader in multi-domain defense solutions, today announced the release of Halo_Shield™, a modular, distributed, and cost-effective counter-unmanned...",Finnhub,https://finnhub.io/api/news?id=7b6574fafa58b9c2bee807fe374d93090366e10b5fe7041e7c78f7ca5e6e175a,1777368442,,AVAV,AVAV
미국주식,"AV Announces Halo_Shield™, Comprehensive Tile-Based C-UAS Solution","ARLINGTON, Va., April 28, 2026--AeroVironment, Inc. (""AV"") (NASDAQ: AVAV), a global leader in multi-domain defense solutions, today announced the release of Halo_Shield™, a modular, distributed, and c",Yahoo,https://finnhub.io/api/news?id=e5fc699deb7eee9fa960e163955a4647f23efd0082258bc206236db2e88f0253,1777381800,,AVAV,AVAV
미국주식,$100 Invested In AeroVironment 10 Years Ago Would Be Worth This Much Today, ,Benzinga,https://finnhub.io/api/news?id=3470b57f36cc8d1f34d372b6120fc6ba47e93a4ca1caaef3fdf4e4d913b8c796,1777396530,,AVAV,AVAV
미국주식,"AV to Present at BofA Securities Industrials, Transportation & Airlines Key Leaders Conference","ARLINGTON, Va., April 29, 2026--AeroVironment, Inc. (""AV"") (NASDAQ: AVAV) will participate in the upcoming BofA Securities Industrials, Transportation & Airlines Key Leaders Conference in New York Cit",Yahoo,https://finnhub.io/api/news?id=c69aaea3309e7feec777f78b619a7b39b51656649e9a221373bca2a3f32ed9ab,1777493400,,AVAV,AVAV
미국주식,Here's Why AeroVironment (AVAV) Fell More Than Broader Market,"In the closing of the recent trading day, AeroVironment (AVAV) stood at $183.5, denoting a -4.6% move from the preceding trading day.",Yahoo,https://finnhub.io/api/news?id=a5f23e274b65422259756478c8a634536b0ca200e2db328a238baecf0551a93a,1777500901,,AVAV,AVAV
미국주식,"AeroVironment - AV to Present at BofA Securities Industrials, Transportation & Airlines Key Leaders Conference","ARLINGTON - AeroVironment, Inc. will participate in the upcoming BofA Securities Industrials, Transportation & Airlines Key Leaders Conference in New York City.AV Chairman, President and Chief...",Finnhub,https://finnhub.io/api/news?id=d2699c0d4e57e75da3a632c5fe7753e198d1046109e9e2ff842af02d95d5f097,1777530516,,AVAV,AVAV
미국주식,"Here Are Thursday’s Top Wall Street Analyst Research Calls: AbbVie, Equinix, GE Healthcare, Kratos Defense, Meta Platforms, Oneok, Palantir Technologies, Wingstop, and More","Pre-Market Stock Futures: Futures are trading higher this morning after a messy Wednesday trading session that saw all major indices except the Nasdaq end lower, with the Nasdaq closing virtually unch",Yahoo,https://finnhub.io/api/news?id=2cf8d7f9b4c8d8bc5f48de81f3fdb93a928a801715e31b918156ce4096c22208,1777549774,,AVAV,AVAV
미국주식,"Meta downgraded, Qualcomm upgraded: Wall Street's top analyst calls","Meta downgraded, Qualcomm upgraded: Wall Street's top analyst calls",Yahoo,https://finnhub.io/api/news?id=716e90c449e657c7f6cb4174fa6b2a1ffe8d1d593ca2b60ebc2646f9b5a138bf,1777556200,,AVAV,AVAV
미국주식,"Textron Leads Defense Advance On Earnings, Analyst Rates AeroVironment A Buy","Textron clears earnings views, announces plans to separate industrials business. Analyst rates AeroVironment a buy. Lockheed Martin, RTX land contracts.",Yahoo,https://finnhub.io/api/news?id=bd593675a248be52a8955ad4a086a7e104e12be012c5789ae6d40b57798d105c,1777558696,,AVAV,AVAV
미국주식,A Fresh Look At AeroVironment (AVAV) Valuation After Recent Share Price Volatility,"What recent performance says about AeroVironment (AVAV) AeroVironment (AVAV) has seen mixed share performance recently, with a 6.3% gain over the past month, a 3.4% decline over the past week, and a 3",Yahoo,https://finnhub.io/api/news?id=ab2ac631badeceba98e35adc9b74672bcd4abfa54b9e5659430fc4b395d3d52c,1777604919,,AVAV,AVAV
미국주식,3 Growth Stocks with Warning Signs,"Growth is a hallmark of all great companies, but the laws of gravity eventually take hold. Those who rode the COVID boom and ensuing tech selloff in 2022 will surely remember that the market’s punishm",Yahoo,https://finnhub.io/api/news?id=373f59f20dcae6a80f6f34a3177aa24169e565ea8da50a04d3c957ad1ea9850e,1777745575,,AVAV,AVAV
미국주식,"Which Drone Stock Will Dominate the Next War: AVAV, KTOS, or ONDS?","Tank warfare defined World War II. German blitzkrieg tactics showed how armored columns could slice through lines when supported by air power and infantry. Today, drones play that same disruptive role",Yahoo,https://finnhub.io/api/news?id=1e2d1ac62c76ae9bb811bba82e563723587077cbed715086567d167dc0d4efa6,1777820188,,AVAV,AVAV
미국주식,"AeroVironment Awarded U.S. Army Prototype Agreement For The Low-Altitude Stalking And Strike Ordnance Program To Support Rapid Development, Delivery And Testing Of The Switchblade 400 Loitering Munition","The award establishes Switchblade 400, AV&#39;s medium-range, man-portable, anti-armor loitering munition, as a key component of the Army&#39;s LASSO program, supporting the service&#39;s modernizatio",Benzinga,https://finnhub.io/api/news?id=ba07da7ab5ae867d0aaf17d8b1c03c2d2161ef92f10e6aabfe23a9bf00d86cd6,1777886124,,AVAV,AVAV
미국주식,U.S. Army selects Av's Switchblade® 400 for Lasso program,AeroVironment Inc: U.S. Army selects Av's Switchblade® 400 for Lasso program...,Finnhub,https://finnhub.io/api/news?id=ed7a13c5718ade912b4536642df5076124ca9d800ed7edb7604fe0d0f5988331,1777886776,,AVAV,AVAV
미국주식,AI Defense Spending Surge Puts a Premium on Proprietary Vision Tech -- and One Nasdaq Player Just Filed a Provisional Patent on the Architecture That Turns Cameras Into Sensors,"Issued on behalf of VisionWave Holdings, Inc.Companies Mentioned: VisionWave Holdings, Inc. , Kratos Defense & Security Solutions, Inc. , AeroVironment, Inc. , Palantir Technologies Inc. , Rekor...",Finnhub,https://finnhub.io/api/news?id=47281fc6f7472f9f72eec30cb19983882611f3f67dd24a26b984c1945eab7a17,1777894227,,AVAV,AVAV
미국주식,U.S. Army Selects AV’s Switchblade® 400 for LASSO Program,"ARLINGTON, Va., May 04, 2026--AeroVironment, Inc. (""AV"") (NASDAQ: AVAV) today announced that it has been awarded a prototype agreement from the U.S. Army for the Low-Altitude Stalking and Strike Ordna",Yahoo,https://finnhub.io/api/news?id=269514d72ef1d0590867c451a8b0c722a0bfb1a95a4f9a94621afe6f531199da,1777900200,,AVAV,AVAV
미국주식,Why Is the US Stock Market Down Today?,S&P 500 drops 0.65% as AI disruption fears hit tech stocks. Get today’s US stock market analysis with sector breakdown and key movers.,Yahoo,https://finnhub.io/api/news?id=5b8442f1b29cbdde1feecebc121b26789696659ef580a7803b017210b21e3416,1771357043,,AVGO,AVGO
미국주식,"Tesla upgraded, AppLovin initiated: Wall Street's top analyst calls","Tesla upgraded, AppLovin initiated: Wall Street's top analyst calls",Yahoo,https://finnhub.io/api/news?id=36ec11a2c407b450f53c7d6f174dfeaa3ae2ddf57e85a2ecae63910222992539,1776174811,,AVGO,AVGO
미국주식,"US Equity Indexes Mixed as Sliding Technology Pulls Nasdaq Composite Lower, Crude Oil Sinks","US equity indexes were mixed as technology declined amid a broad-based rally, while slumping crude o",Yahoo,https://finnhub.io/api/news?id=7b38208956db654576688d8cb6d9701f3313b67f60aa4cdbfb3538e49d223896,1780606473,,AVGO,AVGO
미국주식,"Broadcom miss sparks fears around AI margin pressure, investor says",STORY: Wall Street advanced on Thursday but disappointing results from Broadcom led a chip selloff that held the Nasdaq's gains in check.Broadcom's revenue expectations sent its shares tumbling and ca,Yahoo,https://finnhub.io/api/news?id=df4540192930e8e3ce19b5b0796a60927f582b2963e1057c9e978d3a880a4a79,1780606567,,AVGO,AVGO
미국주식,Stock Market Today: Dow Jumps 875 Points; Ciena Slammed Yet Holds Key Mark; These 2 Areas Shine (Live Coverage),"The Dow Jones index rises and the Nasdaq turns higher. But Broadcom, Ciena and CrowdStrike plunge on earnings.",Yahoo,https://finnhub.io/api/news?id=1ea10f42ad16d330baed7ae99a52f28e5e857a2a00f945c675e75cafad4951b9,1780606890,,AVGO,AVGO
미국주식,Broadcom Could Be The Biggest AI Winner Nobody Is Talking About,The tech giant's recent sell-off is a buying opportunity.,Yahoo,https://finnhub.io/api/news?id=36f6c83ba8879735ae4c6f81cd6778f04cc24a3d87f3caf0a13f7a4eda096a0b,1780607700,,AVGO,AVGO
미국주식,"Dow Hits Record High And S&P 500 Gains As Oil Slides, While Chip Weakness Weighs On Nasdaq — AVGO, UNH, META, PINS, RUM In Focus","Broadcom stock fell nearly 13%, pulling the Nasdaq 100 lower.",Yahoo,https://finnhub.io/api/news?id=9ab51e02126343d860a365e6449f1472c5f214e507e3ae39cb728c4834de96ac,1780608123,,AVGO,AVGO
미국주식,"Stock Market Today, June 4: Broadcom Shares Plunge After AI Outlook Misses High Investor Expectations","Today, June 4, 2026, a historic post-earnings sell-off is forcing investors to rethink AI growth assumptions across chips.",Yahoo,https://finnhub.io/api/news?id=a230048aff7b24cb346406196aa761318c5bae788791ddd82a8ded395c1749c1,1780608219,,AVGO,AVGO
미국주식,"Dow Jones Hits High, AI Stocks Shrug Off Broadcom, Ciena Sell-Offs; Jobs Report Looms","Dow Jones futures fell slightly after hours, along with S&P 500 futures and Nasdaq futures. The May jobs report is on tap before Friday's open. The stock market saw the Dow Jones jump to a record high",Yahoo,https://finnhub.io/api/news?id=03d03f0f811a0bc7b709f4673c6b70577ada081168a64b2edb08d539114be0b7,1780608463,,AVGO,AVGO
미국주식,"Stock Market Today, June 4: Dow Hits Record as Tech Stocks Falter","Broadcom’s downbeat AI outlook is rattling chipmakers even as the Dow notches fresh records, today, June 4, 2026.",Yahoo,https://finnhub.io/api/news?id=c6d76ce04864949e5bfdf2e1c1778085ebad6de6b6eefa2b210076784138998e,1780608516,,AVGO,AVGO
미국주식,Wall St ends mostly higher as Dow claims record closing high,"STORY: U.S. stocks mostly gained ground Thursday as progress toward ending the Iran war buoyed investor sentiment.The Dow rose 1.7% and notched another record closing high, the S&P 500 added four-tent",Yahoo,https://finnhub.io/api/news?id=f1ab9f5df3db79731b1480d5f66411b9cbf6361ae51da6260df0e5f21137758a,1780611415,,AVGO,AVGO
미국주식,Poet Technologies Rose Today Despite Pressures for AI Stocks -- Is It a Buy Right Now?,Poet ended today's trading narrowly in the green. Should investors pile into the photonics stock?,Yahoo,https://finnhub.io/api/news?id=97152a3e807dd678c3fb4c78e4490bc3391b10b447383da760bdc901bdad1baa,1780613180,,AVGO,AVGO
미국주식,"Stock market today: S&P 500, Nasdaq futures slip ahead of May jobs report",US stock futures mostly fell in the wait for the release of the May jobs report.,Yahoo,https://finnhub.io/api/news?id=90dac4e32135d6a6e1280ef53d54798f09d52894e98428a7d5e9671e62a8468a,1780614094,,AVGO,AVGO
미국주식,"Dow Jones Futures: Techs Fall After Dow Hits High, AI Shrugs Off Broadcom, Ciena; Jobs Report Looms","Dow Jones futures were little changed overnight, while S&P 500 futures and Nasdaq futures fell modestly. The May jobs report is on tap before Friday's open. S&P Dow Jones Indices announced late Thursd",Yahoo,https://finnhub.io/api/news?id=6326752a75cb20d60ea3724261f432aa54c031c1402e6cb92d216a9dbf218fc1,1780616902,,AVGO,AVGO
미국주식,Review & Preview: Health Check,"The Dow jumped at the open and held its gains for the entire session, closing up 875 points, or 1.7%.  Artificial intelligence continues to whipsaw tech stocks, with huge up days followed by significa",Yahoo,https://finnhub.io/api/news?id=4cc1e94a89e160742c54ead5d950e202dbea16bef50fb94176b6c0f2646315f2,1780617300,,AVGO,AVGO
미국주식,"Will Broadcom Stock Recover After Its Guidance Disappointment, Or Should You Cut Your Losses?",The stock merely surrendered gains accumulated over the past week.,Yahoo,https://finnhub.io/api/news?id=265f3e61229b84a0e55f5e0ce295d4f3a755a15a85639b69506aff454ca5fe34,1780617355,,AVGO,AVGO
미국주식,Broadcom Stock Investors Just Got Fantastic News from Wall Street,Some investors fear that Broadcom stock has peaked. That could be a costly mistake.,Yahoo,https://finnhub.io/api/news?id=c88ea7fe381c298fec0f581d04ce7471add5390b39c477444851f46f06abc06e,1780620272,,AVGO,AVGO
미국주식,"Broadcom's Selloff Didn't Break The AI Trade, Says Dan Niles: 'Semiconductor Bulls Should Be Thrilled'",Dan Niles warned of a near-term semiconductor pullback amid AI-driven froth but remained bullish long term.,Benzinga,https://finnhub.io/api/news?id=5afcd09065fee5bbc98df34d3810117aa293a5668bc8e3980c66d531ee8db6c9,1780622998,,AVGO,AVGO
미국주식,Which Growth Stock Is a Better Buy: Nvidia or Broadcom?,"Both of these chip giants are central to the AI build-out, but one looks like the better buy today.",Yahoo,https://finnhub.io/api/news?id=d1ea3e3cd5f68d9cf7d2950ea535ad9bccf0409944f5e041b8933df2c84f069a,1780624560,,AVGO,AVGO
미국주식,"Nasdaq, S&P 500, Dow Futures Slip As Chip Stocks Pull Back: LULU, NFLX, KEEL, MRLN Stocks In Focus",American stock futures edged lower after a revenue miss and weaker-than-expected outlook from Broadcom sparked concerns about the semiconductor sector's ongoing rally.,Yahoo,https://finnhub.io/api/news?id=fb7f625c9473b54f5fe7b54893154d233626c1a95caf8824a4b0f73f03260e2b,1780625031,,AVGO,AVGO
미국주식,Shares of companies within the broader technology sector are trading lower amid overall market weakness due to the ongoing conflict in the Middle East and its impact on energy costs.,,Benzinga,https://finnhub.io/api/news?id=2fd675e734a28d25206a33959b2e11879fc68e958ec3baaeb5ac4b1e505a1468,1774883941,,BBAI,BBAI
미국주식,Whitefiber shares are trading higher after BTIG initiated coverage on the stock with a Buy rating and a $20 price target.,,Benzinga,https://finnhub.io/api/news?id=977ca2ad4404829965de371071b87aacaa4d711e144ab39977f544f38f286949,1775820899,,BBAI,BBAI
미국주식,Shares of quantum computing-related companies are trading higher amid continued strength after NVIDIA recently announced the launch of Ising open source quantum AI models.,,Benzinga,https://finnhub.io/api/news?id=af3c964b58c41970101af8a466eb63f85746399b2344620aadf16cdc28a8eb02,1776324980,,BBAI,BBAI
미국주식,"Tech Heavyweights To Report Next Week, Fed Rate Decision Also In Focus","Wall Street Week Ahead: key earnings (Apple, Microsoft), Fed decision, GDP & jobs, IPOs and dividends. Read here for more details.",SeekingAlpha,https://finnhub.io/api/news?id=243e7598cd3a10648c457f839370db2fb2933ffa9e1403774f2e65d86e43a4d1,1777114800,,BBAI,BBAI
미국주식,BigBear.ai Stock Is Trending: A Key Level Just Came Into Play,"BigBear.ai Inc (NYSE:BBAI) shares are ripping higher on Tuesday, defying a weak Nasdaq and broad tech sector losses.",Benzinga,https://finnhub.io/api/news?id=4c31b5d1068724877879350843b5125536b54892641474905a2a1aa12eb58d29,1777385993,,BBAI,BBAI
미국주식,Curious about the most active stocks on Tuesday?,Curious about the most active stocks in today's session? Get a glimpse into the stocks that are generating the highest trading volume and capturing market attention.,ChartMill,https://finnhub.io/api/news?id=740c828a720278fcdc5f32f902999cc1156adbb8c6291636db9ff731fa1bc031,1777399200,,BBAI,BBAI
미국주식,What's Going On With BigBear.ai Stock Wednesday?,BigBear.ai (BBAI) shares rally 6% ahead of May 5 earnings. Can the company beat estimates again? See the latest price levels and analysis.,Benzinga,https://finnhub.io/api/news?id=65b776b01fe6ea9d4be66ddf0612a57ee7d4dbf46b42699ffc3e8425556b0dcb,1777454174,,BBAI,BBAI
미국주식,BigBear.ai Stock Edges Higher Ahead Of Key May Earnings Report,BigBear.ai Holdings shares are edging higher Friday as traders repositioned for next week&#39;s earnings after options-driven volatility.,Benzinga,https://finnhub.io/api/news?id=84942f30301132eff4dd87fdc06192ef6665f994dd38a0a776d2fb96ce8a42fb,1777636520,,BBAI,BBAI
미국주식,"GigCapital7 Corp. Announces Non-Redemption Agreements Funding in the Approximate Amount of at Least $19.3 Million in Conjunction with the Anticipated Closing of the Business Combination with Hadron Energy, Inc.","NEW YORK - GigCapital7 Corp. today announced that it has directly solicited and entered into non-redemption agreements with a few public stockholders, pursuant to which such stockholders have...",Finnhub,https://finnhub.io/api/news?id=d2222dcf8211e1b03126d8dec9a95d448b11c081baab70767581cec3634c8e41,1777879951,,BBAI,BBAI
미국주식,"Earnings Scheduled For May 5, 2026", ,Benzinga,https://finnhub.io/api/news?id=ef8b73926c0b0f31ad27a343a71dde4b6c20b85b085a7c8f45b619a8acff1738,1777965123,,BBAI,BBAI
미국주식,"BigBear.ai Announces First Quarter 2026 Results, Increases Backlog Including More Than $60 million in National Security Contracts, and Affirms Revenue Guidance","1Q 26 revenue of $34.4 million; gross margins expanded 1,278 basis points from 21.3% to 34.0% year-over-yearBacklog increased 14% from the fourth quarter to $281.9 million, primarily driven by a...",Finnhub,https://finnhub.io/api/news?id=aa329454a2b12d0c73b150c36fa17003bb3af7c7e0d484a3a375cc10010f0515,1777997828,,BBAI,BBAI
미국주식,"BigBear.ai Hldgs Q1 Adj. EPS $(0.04) Beats $(0.08) Estimate, Sales $34.435M Beat $33.598M Estimate",BigBear.ai Hldgs (NYSE:BBAI) reported quarterly losses of $(0.04) per share which beat the analyst consensus estimate of $(0.08) by 50 percent. This is a 84 percent increase over losses of $(0.25) per,Benzinga,https://finnhub.io/api/news?id=7f5221023af1c4cdfd37f317e809cac78a03113714ceb14168f8cbbba3c45980,1777998821,,BBAI,BBAI
미국주식,BigBear.ai Holdings Affirms FY2026 Sales Guidance of $135.000M-$165.000M vs $142.546M Est,BigBear.ai Holdings (NYSE:BBAI) affirms FY2026 sales outlook from $135.000 million-$165.000 million to $135.000 million-$165.000 million vs $142.546 million estimate.,Benzinga,https://finnhub.io/api/news?id=61c2abed39375ac41fd221bdfd0f8561cb6c40d47f9015e9d38326d6be94e356,1777998829,,BBAI,BBAI
미국주식,BigBear.AI Stock Slips On Q1 Earnings,BigBear reports financial results for the first quarter after the market close on Tuesday. Here&#39;s a look at the key details from the print.,Benzinga,https://finnhub.io/api/news?id=2926d7656d6583a04c377bdab85ee733c13c960385426330358e80df72efccaf,1778000794,,BBAI,BBAI
미국주식,BigBear.ai Holdings Inc NYSE:BBAI Q1 2026 Earnings Beat Fails to Impress Amid Cash Burn Concerns,"BigBear.ai beats Q1 estimates slightly but stock falls on cash burn concerns. Revenue hit $34.4M, backlog surged to $75M, and debt was cut significantly.",ChartMill,https://finnhub.io/api/news?id=31f7d883876748f4c3c739e8c047a26ec704fd06f18a2efe19ed6a224105472e,1778023422,,BBAI,BBAI
미국주식,"BigBear.ai Holdings, Inc. 2026 Q1 - Results - Earnings Call Presentation","2026-05-06. The following slide deck was published by BigBear.ai Holdings, Inc.",SeekingAlpha,https://finnhub.io/api/news?id=b77055def5545f8d916bf3e5d7374b569ba9233a517e26ca26a33f8cf3c4c53a,1778027454,,BBAI,BBAI
미국주식,"BigBear.ai Q1: Nothing Exciting Here, But Could Be If Momentum Is Sustained","BigBear.ai Holdings, Inc. Q1 update: flat revenue, margin gains from Ask Sage, big liquidity, and 2026 guidance reaffirmed. Click for this BBAI earnings review.",SeekingAlpha,https://finnhub.io/api/news?id=6492a53c2b571d9df8de66f881e8486374c63c914e6fe64f16bd9a9e3b058ed6,1778069895,,BBAI,BBAI
미국주식,10 Information Technology Stocks Whale Activity In Today's Session, ,Benzinga,https://finnhub.io/api/news?id=73bc6bc4e1e99f9cb4e0cec27bbddfb53225fcacd3085b3a1f6c2aec626e66a7,1778160940,,BBAI,BBAI
미국주식,What's Going On With BigBear.ai Shares Friday?,BigBear.ai Holdings (NYSE: BBAI) shares are edging down Friday afternoon as traders keep reacting to its latest quarterly update and guidance.,Benzinga,https://finnhub.io/api/news?id=0d7f96fb51df6d015d43ea454805d3ad8c544e9ac022f7c18c952916bd3e24dc,1778252023,,BBAI,BBAI
미국주식,"Transcript : BigBear.ai Holdings, Inc., Q1 2026 Earnings Call, May 05, 2026","Presentation Operator MessageOperator Greetings, and welcome to the BigBear.ai Holdings First Quarter 2026 Earnings Call. [Operator Instructions] Please note, this conference is being recorded. I",Finnhub,https://finnhub.io/api/news?id=93aee40a091d25cf94873d662901ea40af1403816f81cdaa654f50c6f805eafb,1778268028,,BBAI,BBAI
미국주식,"Bitmine Immersion Technologies (BMNR) Announces ETH Holdings Reach Unprecedented World Record of 5.078 Million Tokens, and Total Crypto and Total Cash Holdings of $13.3 Billion",Bitmine owns more than 4.21% of the total ETH coin supply of 120.7 millionBitmine is 84% of the way to the 'Alchemy of 5%' in just 10 monthsEthereum continues to benefit from the dual tailwinds of...,Finnhub,https://finnhub.io/api/news?id=a772ba0afc0532a9788090ecc473eb732c5b0cdf3f34c42bb90bf1797191b07a,1777278669,,BMNR,BMNR
