market,query,attempt_label,endpoint,title,description,url,source,publishedAt,sentiment,summary_ko,status,fetched_at
한국주식,KOSPI stock market,KOSPI/en/kr,search,"Stock market, US Iran deal: Sensex, Nifty gap up start likely; stocks to watch",Stock market today: South Korea's Kospi and Japan's Nikkei jumped 5 per cent each. Mainland China's Shanghai Composite and Hong Kong's Hang Seng advanced 1 per cent each.,https://www.businesstoday.in/markets/stocks/story/stock-market-us-iran-deal-sensex-nifty-set-to-see-gap-up-start-stocks-to-watch-536803-2026-06-15,Business Today,2026-06-15T02:30:26Z,중립,"Stock market, US Iran deal: Sensex, Nifty gap up start likely; stocks to watch — Stock market today: South Korea's Kospi and Japan's Nikkei jumped 5 per cent each. Mainland China's Shanghai Composite and Hong Kong's Hang Seng advanced 1 per cent each.",OK,2026-06-16T21:51:01
한국주식,KOSPI stock market,KOSPI/en/kr,search,World's hottest stock market turns focus to MSCI moment,"South Korea's stock market is nearing a significant milestone. Investors are watching for a potential upgrade to developed-market status by MSCI. The Kospi has seen a massive surge this year, fueled by artificial intelligence stocks. While volatility is high, reforms are underway.",https://economictimes.indiatimes.com/markets/stocks/news/worlds-hottest-stock-market-turns-focus-to-msci-moment/articleshow/131730711.cms,The Economic Times,2026-06-15T00:01:00Z,긍정,World's hottest stock market turns focus to MSCI moment — South Korea's stock market is nearing a significant milestone. Investors are watching for a potential upgrade to developed-market status by MSCI. The Kospi has seen a massive surge,OK,2026-06-16T21:51:01
한국주식,KOSPI stock market,KOSPI/en/kr,search,South Korea's world-beating stock market eyes long-awaited MSCI moment,"The Kospi has become the world's best-performing major equity benchmark this year, surging more than 90% as investors piled into artificial-intelligence winners",https://www.business-standard.com/markets/news/south-korea-s-world-beating-stock-market-eyes-long-awaited-msci-moment-126061400076_1.html,Business Standard,2026-06-14T01:45:19Z,중립,"South Korea's world-beating stock market eyes long-awaited MSCI moment — The Kospi has become the world's best-performing major equity benchmark this year, surging more than 90% as investors piled into artificial-intelligence winners",OK,2026-06-16T21:51:01
한국주식,KOSPI stock market,KOSPI/en/kr,search,South Korea’s world-beating stock market eyes its MSCI moment,"The Kospi has become the world’s best-performing major equity benchmark this year, surging more than 90% as investors piled into artificial-intelligence winners.",https://www.moneycontrol.com/news/business/south-korea-s-world-beating-stock-market-eyes-its-msci-moment-13948919.html,Moneycontrol,2026-06-14T01:21:28Z,중립,"South Korea’s world-beating stock market eyes its MSCI moment — The Kospi has become the world’s best-performing major equity benchmark this year, surging more than 90% as investors piled into artificial-intelligence winners.",OK,2026-06-16T21:51:01
한국주식,KOSPI stock market,KOSPI/en/kr,search,South Korea's Kospi jumps over 8%; world's best performing market up 95% in 2026 so far,"The South Korean benchmark remains the world's best-performing major stock index in 2026. The KOSPI has gained 95.43 per cent so far this year, supported largely by strong buying in semiconductor stocks amid continued enthusiasm around artificial intelligence (AI)-related themes.",https://www.businesstoday.in/markets/stocks/story/south-koreas-kospi-jumps-over-8-worlds-best-performing-market-up-95-in-2026-so-far-536470-2026-06-12,Business Today,2026-06-12T05:21:22Z,긍정,"South Korea's Kospi jumps over 8%; world's best performing market up 95% in 2026 so far — The South Korean benchmark remains the world's best-performing major stock index in 2026. The KOSPI has gained 95.43 per cent so far this year, supported largely by strong buying i",OK,2026-06-16T21:51:01
한국주식,KOSPI stock market,KOSPI/en/kr,search,Stock Market LIVE: GIFT Nifty gains 200 pts; Kospi jumps 8% as Trump says deal with Iran is close,"Sensex Today | Stock Market LIVE Updates, June 12: The GIFT Nifty indicated a positive open as US President Donald Trump indicated a deal with Iran is expected soon. South Korea's Kospi jumped over 8%",https://www.business-standard.com/markets/news/stock-market-live-june-12-nse-bse-sensex-today-nifty-gift-nifty-us-iran-deal-brent-crude-oil-price-ipo-126061200119_1.html,Business Standard,2026-06-12T02:41:48Z,중립,"Stock Market LIVE: GIFT Nifty gains 200 pts; Kospi jumps 8% as Trump says deal with Iran is close — Sensex Today | Stock Market LIVE Updates, June 12: The GIFT Nifty indicated a positive open as US President Donald Trump indicated a deal with Iran is expected soon. South Korea's ",OK,2026-06-16T21:51:01
한국주식,KOSPI stock market,KOSPI/en/kr,search,"Stock market, Trump Iran deal: Brent below $90, Asian shares rallying; will Sensex, Nifty join the party?","Kospi climbed 7.66 per cent to 8,358.33. Japan's Nikkei was up 3.77 per cent at 66,640. Markets across Hong Kong and mainland China advanced 1.3-1.6 per cent each.",https://www.businesstoday.in/markets/stocks/story/stock-market-trump-iran-deal-brent-below-90-asian-shares-rallying-will-sensex-nifty-join-the-party-536433-2026-06-12,Business Today,2026-06-12T02:25:41Z,중립,"Stock market, Trump Iran deal: Brent below $90, Asian shares rallying; will Sensex, Nifty join the party? — Kospi climbed 7.66 per cent to 8,358.33. Japan's Nikkei was up 3.77 per cent at 66,640. Markets across Hong Kong and mainland China advanced 1.3-1.6 per cent each.",OK,2026-06-16T21:51:01
한국주식,KOSPI stock market,KOSPI/en/kr,search,"From Gift Nifty, US-Iran peace deal to Kospi, Nikkei rally: 10 key things that changed for Indian stock market overnight","Gift Nifty was trading around 23,487 level, a premium of nearly 287 points from the Nifty futures’ previous close, indicating a gap-up start for the Indian stock market indices.",https://www.livemint.com/market/stock-market-news/from-gift-nifty-us-iran-peace-deal-to-kospi-nikkei-rally-10-key-things-that-changed-for-indian-stock-market-overnight-11781228807708.html,Livemint,2026-06-12T01:52:32Z,중립,"From Gift Nifty, US-Iran peace deal to Kospi, Nikkei rally: 10 key things that changed for Indian stock market overnight — Gift Nifty was trading around 23,487 level, a premium of nearly 287 points from the Nifty futures’ previous close, indicating a gap-up start for the Indian stock market indices.",OK,2026-06-16T21:51:01
한국주식,KOSPI stock market,KOSPI/en/kr,search,Korea’s Kospi Extends Wild Swings as Chip Stocks Resume Slide,"South Korea’s stock market lurched from one extreme to another for a third straight session Wednesday, extending a stretch of swings that has whipsawed investors and repeatedly triggered market safeguards.",https://www.livemint.com/market/koreas-kospi-extends-wild-swings-as-chip-stocks-resume-slide-11781132225126.html,Livemint,2026-06-10T22:57:04Z,중립,"Korea’s Kospi Extends Wild Swings as Chip Stocks Resume Slide — South Korea’s stock market lurched from one extreme to another for a third straight session Wednesday, extending a stretch of swings that has whipsawed investors and repeatedly tri",OK,2026-06-16T21:51:01
한국주식,top:business,top business/ko/kr,top-headlines,“스페이스X 담은 ETF 찾기 왜이리 힘들지?”…25% 꽉 채운 KODEX의 비법,삼성자산운용 특별 편입절차 마련 미래에셋은 액티브 ETF서 2.9% 채워,https://www.mk.co.kr/news/stock/12075153,매일경제,2026-06-16T00:41:05Z,중립,“스페이스X 담은 ETF 찾기 왜이리 힘들지?”…25% 꽉 채운 KODEX의 비법 — 삼성자산운용 특별 편입절차 마련 미래에셋은 액티브 ETF서 2.9% 채워,OK,2026-06-16T21:51:02
한국주식,top:business,top business/ko/kr,top-headlines,"한화오션, 캐나다 잠수함 수주전 '청신호'… 경쟁사 독일 TKMS 70유로 방어선 위태",독일 금융 전문 매체 셰어딜즈(Sharedeals)는 지난 15일(현지시각) 유럽 해군 방산의 핵심 기업인 티센크루프 마린 시스템즈(TKMS)의 주가가 주요 지지선을 시험받는 기술적 조정 국면에 들어섰다고 보도했다.글로벌 군비 증강이라는 거대한 구조적 순풍 속에서도 단기 수급 악화와 차,https://www.g-enews.com/article/Global-Biz/2026/06/202606160909122617fbbec65dfb_1,글로벌이코노믹,2026-06-16T00:35:37Z,긍정,"한화오션, 캐나다 잠수함 수주전 '청신호'… 경쟁사 독일 TKMS 70유로 방어선 위태 — 독일 금융 전문 매체 셰어딜즈(Sharedeals)는 지난 15일(현지시각) 유럽 해군 방산의 핵심 기업인 티센크루프 마린 시스템즈(TKMS)의 주가가 주요 지지선을 시험받는 기술적 조정 국면에 들어섰다고 보도했다.글로벌 군비 증강이라는 거대한 구조적 순풍 속에서도 단기 수급 악화와 차",OK,2026-06-16T21:51:02
한국주식,top:business,top business/ko/kr,top-headlines,"BOJ, 이달 금리 인상 전망…우치다 부총재 회견 주목","(서울=연합인포맥스) 박지은 기자 = 일본은행(BOJ)이 이달 금융정책결정회의에서 기준금리를 현행 0.75%에서 1%로 인상할 것으로 예상된다. 시장의 관심은 우치다 신이치 일본은행 부총재가 회의 후 기자회견에서 추가 금리 인상 시기와 속도에 관해 어떤 힌트를 내놓을지에 쏠리고 있다.◇31년 만에 최고 수준으로 인상 예상시장 참가자들은 BOJ가 중동 분쟁으로 인한 물가 상승 위험에 대응하기 위해 이달 회의에서 기준금리를 1%로 인상할 가능성을 거의 확실시하고 있다. BOJ가 금리 인상을 단행할 경우, 이는 지난해 12월 이후 6개월",https://news.einfomax.co.kr/news/articleView.html?idxno=4420153,연합인포맥스,2026-06-16T00:30:07Z,긍정,"BOJ, 이달 금리 인상 전망…우치다 부총재 회견 주목 — (서울=연합인포맥스) 박지은 기자 = 일본은행(BOJ)이 이달 금융정책결정회의에서 기준금리를 현행 0.75%에서 1%로 인상할 것으로 예상된다. 시장의 관심은 우치다 신이치 일본은행 부총재가 회의 후 기자회견에서 추가 금리 인상 시기와 속도에 관해 어떤 힌트를 내놓을지에 쏠리고 있다.◇31년 만에 최고 수준으로 인상 예상",OK,2026-06-16T21:51:02
한국주식,top:business,top business/ko/kr,top-headlines,‘스벅 역사교육’ 제안했던 광주시장 “오월정신 더 단단히 자리잡길”,5·18 광주민주화운동 기념일에 ‘탱크데이’ 마케팅을 진행해 논란이 된 스타벅스코리아가 매장 문을 닫고 역사 교육을 하기로 하자 강기정 광주광역시장이 환영의 입장을 밝혔다. 강 시장은 15일 페이스북에서 “스타벅스코리아의 선택을 존중한다”고 밝혔다. 강 시장은 “지난,https://www.hani.co.kr/arti/society/society_general/1263733.html,한겨레,2026-06-16T00:27:00Z,중립,‘스벅 역사교육’ 제안했던 광주시장 “오월정신 더 단단히 자리잡길” — 5·18 광주민주화운동 기념일에 ‘탱크데이’ 마케팅을 진행해 논란이 된 스타벅스코리아가 매장 문을 닫고 역사 교육을 하기로 하자 강기정 광주광역시장이 환영의 입장을 밝혔다. 강 시장은 15일 페이스북에서 “스타벅스코리아의 선택을 존중한다”고 밝혔다. 강 시장은 “지난,OK,2026-06-16T21:51:02
한국주식,top:business,top business/ko/kr,top-headlines,“신축 살아보는 게 꿈이에요”…전국 2곳 중 1곳 ‘20년 이상’ 노후 아파트,수도권에서 20년 이상 노후 아파트의 비율이 절반을 넘어서는 등 아파트 노후화가 심화하는 모양새다. 16일 부동산R114 자료에 따르면 지난 12일 기준 전국 아파트 총 1150만2082가구 중 준공된 지 20년이 지난 노후 아파트는 652만2360가구로 전체의 56.7%로 조사됐다. 전국 2가구 중 1가구 이상이 노후 주택인 셈이다. 신도시 조성 등으로,https://www.mk.co.kr/news/realestate/12075080,매일경제,2026-06-16T00:07:05Z,중립,“신축 살아보는 게 꿈이에요”…전국 2곳 중 1곳 ‘20년 이상’ 노후 아파트 — 수도권에서 20년 이상 노후 아파트의 비율이 절반을 넘어서는 등 아파트 노후화가 심화하는 모양새다. 16일 부동산R114 자료에 따르면 지난 12일 기준 전국 아파트 총 1150만2082가구 중 준공된 지 20년이 지난 노후 아파트는 652만2360가구로 전체의 56.7%로 조사됐다. 전국 2가구 중 1가구 이상이 노후 ,OK,2026-06-16T21:51:02
한국주식,top:business,top business/ko/kr,top-headlines,“삼전닉스 매도버튼 손 떼세요”…금리소음 잦아들면 진가 나온다는데 [오늘 나온 보고서],하나증권 “코스피 변동장은 일시적”국제유가 하락 따른 금리부담 완화메모리 주도주로 다시 자금 몰릴듯하이닉스 ADR 외인 자금복귀 계기,https://www.mk.co.kr/news/stock/12075072,매일경제,2026-06-15T23:54:33Z,부정/주의,“삼전닉스 매도버튼 손 떼세요”…금리소음 잦아들면 진가 나온다는데 [오늘 나온 보고서] — 하나증권 “코스피 변동장은 일시적”국제유가 하락 따른 금리부담 완화메모리 주도주로 다시 자금 몰릴듯하이닉스 ADR 외인 자금복귀 계기,OK,2026-06-16T21:51:02
한국주식,top:business,top business/ko/kr,top-headlines,"인터넷은행, 신규 마통 전면 중단할 듯…고강도 대책 발표",인터넷전문은행 3사가 신용대출의 한도 축소에 더해 신규 마이너스 통장 개설을 중단하는 방안까지 고강도 대출 축소 계획을 검토하고 있다.인뱅 3사가 한번에 신규 마통 개설을 중단하는 것은 설립 이레 처음이다.16일 금융권에 따르면 인뱅 3사는 이러한 내용의 신용대출 축소 방안을 금융위원회에 최근 보고했다.케이뱅크는 가장 발 빠르게 대책을 내놨다. 케이뱅크는 이날부터 신규 마통 개설 신청을 다음 달 31일까지 일시 중단하기로 했다. 일일 신용대출 신청 물량도 제한하면서 '고액 연봉자'를 대상으로 신규 신용대출 한도를 축소할 방침이다.,https://news.einfomax.co.kr/news/articleView.html?idxno=4420129,연합인포맥스,2026-06-15T23:48:38Z,중립,"인터넷은행, 신규 마통 전면 중단할 듯…고강도 대책 발표 — 인터넷전문은행 3사가 신용대출의 한도 축소에 더해 신규 마이너스 통장 개설을 중단하는 방안까지 고강도 대출 축소 계획을 검토하고 있다.인뱅 3사가 한번에 신규 마통 개설을 중단하는 것은 설립 이레 처음이다.16일 금융권에 따르면 인뱅 3사는 이러한 내용의 신용대출 축소 방안을 금융위원회에 최근 보고했다.케이뱅크는 가장 발",OK,2026-06-16T21:51:02
한국주식,top:business,top business/ko/kr,top-headlines,"'스페이스X 공모주 무산' 후폭풍…연기금, 미래에셋증권 던졌다",스페이스X 공모주 물량 배정 실패 후폭풍이 미래에셋증권 수급에도 영향을 미치고 있다.5거래일 만에 코스피 순매수로 돌아섰던 연기금도 평판 리스크에 휩싸인 미래에셋증권 주식은 계속 처분하는 모습을 보였다.16일 연합인포맥스 투자자별 매매상위종목(화면번호 3330)에 따르면 전일 연기금은 미래에셋증권을 385억원어치 순매도했다.하루 만에 6.42% 오르면서 포트폴리오 리밸런싱(재조정) 차원의 매도가 필요했던 SK하이닉스(541억원) 다음으로 큰 규모다.이날은 연기금이 코스피에서 5거래일 만에 순매수로 돌아선 날이었다.삼성증권(46억원,https://news.einfomax.co.kr/news/articleView.html?idxno=4420127,연합인포맥스,2026-06-15T23:45:00Z,부정/주의,"'스페이스X 공모주 무산' 후폭풍…연기금, 미래에셋증권 던졌다 — 스페이스X 공모주 물량 배정 실패 후폭풍이 미래에셋증권 수급에도 영향을 미치고 있다.5거래일 만에 코스피 순매수로 돌아섰던 연기금도 평판 리스크에 휩싸인 미래에셋증권 주식은 계속 처분하는 모습을 보였다.16일 연합인포맥스 투자자별 매매상위종목(화면번호 3330)에 따르면 전일 연기금은 미래에셋증권을 385억원어치 순매도했",OK,2026-06-16T21:51:02
한국주식,top:business,top business/ko/kr,top-headlines,"법원, '회생 신청' JTBC 등 중앙그룹 5개사 자산·채권 동결",(서울=연합뉴스) 김빛나 기자 = 법원이 기업회생을 신청한 종합편성채널 JTBC 등 중앙그룹 5개사의 자산과 채권을 동결했다.,https://www.yna.co.kr/view/AKR20260616024500004,연합뉴스,2026-06-15T23:17:14Z,중립,"법원, '회생 신청' JTBC 등 중앙그룹 5개사 자산·채권 동결 — (서울=연합뉴스) 김빛나 기자 = 법원이 기업회생을 신청한 종합편성채널 JTBC 등 중앙그룹 5개사의 자산과 채권을 동결했다.",OK,2026-06-16T21:51:02
한국주식,top:business,top business/ko/kr,top-headlines,"""같은 회사인데 왜 중국엔 더 줬나""…'9배' 훌쩍 차이 난 K바이오 몸값[韓-中 바이오 명암]①",편집자주올 상반기 한국 바이오 기술기업들이 글로벌 빅파마와의 조(兆) 단위 기술수출 계약을 잇따라 성사시키며 산업 전반에 대한 기대감이 높아지는 분위기다.,https://www.asiae.co.kr/article/2026060908060639753,아시아경제,2026-06-15T23:00:00Z,중립,"""같은 회사인데 왜 중국엔 더 줬나""…'9배' 훌쩍 차이 난 K바이오 몸값[韓-中 바이오 명암]① — 편집자주올 상반기 한국 바이오 기술기업들이 글로벌 빅파마와의 조(兆) 단위 기술수출 계약을 잇따라 성사시키며 산업 전반에 대한 기대감이 높아지는 분위기다.",OK,2026-06-16T21:51:02
미국주식,Federal Reserve Treasury yields stocks,macro/en/us,search,"S&P 500, Nasdaq 100 Drop As Rate-Hike Bets Build, Oil Climbs",U.S. stocks retreated from record highs at midday Wednesday as hotter-than-expected economic data and a renewed surge in Treasury yields revived fears the Federal Reserve could soon raise interest rates.,https://www.benzinga.com/markets/equities/26/06/52980840/stocks-retreat-records-rate-hike-bets-oil-climbs-iran-markets-wednesday,Benzinga,2026-06-03T17:25:47Z,긍정,"S&P 500, Nasdaq 100 Drop As Rate-Hike Bets Build, Oil Climbs — U.S. stocks retreated from record highs at midday Wednesday as hotter-than-expected economic data and a renewed surge in Treasury yields revived fears the Federal Reserve could soo",OK,2026-06-16T21:51:04
