market,query,attempt_label,endpoint,title,description,url,source,publishedAt,sentiment,summary_ko,status,fetched_at
한국주식,KOSPI stock market,KOSPI/en/kr,search,"Stock market, US Iran deal: Sensex, Nifty gap up start likely; stocks to watch",Stock market today: South Korea's Kospi and Japan's Nikkei jumped 5 per cent each. Mainland China's Shanghai Composite and Hong Kong's Hang Seng advanced 1 per cent each.,https://www.businesstoday.in/markets/stocks/story/stock-market-us-iran-deal-sensex-nifty-set-to-see-gap-up-start-stocks-to-watch-536803-2026-06-15,Business Today,2026-06-15T02:30:26Z,중립,"Stock market, US Iran deal: Sensex, Nifty gap up start likely; stocks to watch — Stock market today: South Korea's Kospi and Japan's Nikkei jumped 5 per cent each. Mainland China's Shanghai Composite and Hong Kong's Hang Seng advanced 1 per cent each.",OK,2026-06-16T18:03:00
한국주식,KOSPI stock market,KOSPI/en/kr,search,World's hottest stock market turns focus to MSCI moment,"South Korea's stock market is nearing a significant milestone. Investors are watching for a potential upgrade to developed-market status by MSCI. The Kospi has seen a massive surge this year, fueled by artificial intelligence stocks. While volatility is high, reforms are underway.",https://economictimes.indiatimes.com/markets/stocks/news/worlds-hottest-stock-market-turns-focus-to-msci-moment/articleshow/131730711.cms,The Economic Times,2026-06-15T00:01:00Z,긍정,World's hottest stock market turns focus to MSCI moment — South Korea's stock market is nearing a significant milestone. Investors are watching for a potential upgrade to developed-market status by MSCI. The Kospi has seen a massive surge,OK,2026-06-16T18:03:00
한국주식,KOSPI stock market,KOSPI/en/kr,search,South Korea's world-beating stock market eyes long-awaited MSCI moment,"The Kospi has become the world's best-performing major equity benchmark this year, surging more than 90% as investors piled into artificial-intelligence winners",https://www.business-standard.com/markets/news/south-korea-s-world-beating-stock-market-eyes-long-awaited-msci-moment-126061400076_1.html,Business Standard,2026-06-14T01:45:19Z,중립,"South Korea's world-beating stock market eyes long-awaited MSCI moment — The Kospi has become the world's best-performing major equity benchmark this year, surging more than 90% as investors piled into artificial-intelligence winners",OK,2026-06-16T18:03:00
한국주식,KOSPI stock market,KOSPI/en/kr,search,South Korea’s world-beating stock market eyes its MSCI moment,"The Kospi has become the world’s best-performing major equity benchmark this year, surging more than 90% as investors piled into artificial-intelligence winners.",https://www.moneycontrol.com/news/business/south-korea-s-world-beating-stock-market-eyes-its-msci-moment-13948919.html,Moneycontrol,2026-06-14T01:21:28Z,중립,"South Korea’s world-beating stock market eyes its MSCI moment — The Kospi has become the world’s best-performing major equity benchmark this year, surging more than 90% as investors piled into artificial-intelligence winners.",OK,2026-06-16T18:03:00
한국주식,KOSPI stock market,KOSPI/en/kr,search,South Korea's Kospi jumps over 8%; world's best performing market up 95% in 2026 so far,"The South Korean benchmark remains the world's best-performing major stock index in 2026. The KOSPI has gained 95.43 per cent so far this year, supported largely by strong buying in semiconductor stocks amid continued enthusiasm around artificial intelligence (AI)-related themes.",https://www.businesstoday.in/markets/stocks/story/south-koreas-kospi-jumps-over-8-worlds-best-performing-market-up-95-in-2026-so-far-536470-2026-06-12,Business Today,2026-06-12T05:21:22Z,긍정,"South Korea's Kospi jumps over 8%; world's best performing market up 95% in 2026 so far — The South Korean benchmark remains the world's best-performing major stock index in 2026. The KOSPI has gained 95.43 per cent so far this year, supported largely by strong buying i",OK,2026-06-16T18:03:00
한국주식,KOSPI stock market,KOSPI/en/kr,search,Stock Market LIVE: GIFT Nifty gains 200 pts; Kospi jumps 8% as Trump says deal with Iran is close,"Sensex Today | Stock Market LIVE Updates, June 12: The GIFT Nifty indicated a positive open as US President Donald Trump indicated a deal with Iran is expected soon. South Korea's Kospi jumped over 8%",https://www.business-standard.com/markets/news/stock-market-live-june-12-nse-bse-sensex-today-nifty-gift-nifty-us-iran-deal-brent-crude-oil-price-ipo-126061200119_1.html,Business Standard,2026-06-12T02:41:48Z,중립,"Stock Market LIVE: GIFT Nifty gains 200 pts; Kospi jumps 8% as Trump says deal with Iran is close — Sensex Today | Stock Market LIVE Updates, June 12: The GIFT Nifty indicated a positive open as US President Donald Trump indicated a deal with Iran is expected soon. South Korea's ",OK,2026-06-16T18:03:00
한국주식,KOSPI stock market,KOSPI/en/kr,search,"Stock market, Trump Iran deal: Brent below $90, Asian shares rallying; will Sensex, Nifty join the party?","Kospi climbed 7.66 per cent to 8,358.33. Japan's Nikkei was up 3.77 per cent at 66,640. Markets across Hong Kong and mainland China advanced 1.3-1.6 per cent each.",https://www.businesstoday.in/markets/stocks/story/stock-market-trump-iran-deal-brent-below-90-asian-shares-rallying-will-sensex-nifty-join-the-party-536433-2026-06-12,Business Today,2026-06-12T02:25:41Z,중립,"Stock market, Trump Iran deal: Brent below $90, Asian shares rallying; will Sensex, Nifty join the party? — Kospi climbed 7.66 per cent to 8,358.33. Japan's Nikkei was up 3.77 per cent at 66,640. Markets across Hong Kong and mainland China advanced 1.3-1.6 per cent each.",OK,2026-06-16T18:03:00
한국주식,KOSPI stock market,KOSPI/en/kr,search,"From Gift Nifty, US-Iran peace deal to Kospi, Nikkei rally: 10 key things that changed for Indian stock market overnight","Gift Nifty was trading around 23,487 level, a premium of nearly 287 points from the Nifty futures’ previous close, indicating a gap-up start for the Indian stock market indices.",https://www.livemint.com/market/stock-market-news/from-gift-nifty-us-iran-peace-deal-to-kospi-nikkei-rally-10-key-things-that-changed-for-indian-stock-market-overnight-11781228807708.html,Livemint,2026-06-12T01:52:32Z,중립,"From Gift Nifty, US-Iran peace deal to Kospi, Nikkei rally: 10 key things that changed for Indian stock market overnight — Gift Nifty was trading around 23,487 level, a premium of nearly 287 points from the Nifty futures’ previous close, indicating a gap-up start for the Indian stock market indices.",OK,2026-06-16T18:03:00
한국주식,KOSPI stock market,KOSPI/en/kr,search,Korea’s Kospi Extends Wild Swings as Chip Stocks Resume Slide,"South Korea’s stock market lurched from one extreme to another for a third straight session Wednesday, extending a stretch of swings that has whipsawed investors and repeatedly triggered market safeguards.",https://www.livemint.com/market/koreas-kospi-extends-wild-swings-as-chip-stocks-resume-slide-11781132225126.html,Livemint,2026-06-10T22:57:04Z,중립,"Korea’s Kospi Extends Wild Swings as Chip Stocks Resume Slide — South Korea’s stock market lurched from one extreme to another for a third straight session Wednesday, extending a stretch of swings that has whipsawed investors and repeatedly tri",OK,2026-06-16T18:03:00
한국주식,Korea stock market,wide Korea/no-filter,search,South Korea's World-Beating Stock Market Eyes Its MSCI Moment,"Now investors are awaiting MSCI Inc.'s annual market-classification review on June 23, when the index provider will decide whether Korea finally earns a place on the watchlist for developed-market status, the first step toward an eventual upgrade.",https://www.ndtvprofit.com/markets/south-koreas-world-beating-stock-market-eyes-its-msci-moment-11633752,NDTV Profit,2026-06-14T03:54:11Z,긍정,"South Korea's World-Beating Stock Market Eyes Its MSCI Moment — Now investors are awaiting MSCI Inc.'s annual market-classification review on June 23, when the index provider will decide whether Korea finally earns a place on the watchlist for ",OK,2026-06-16T18:03:01
한국주식,Korea stock market,wide Korea/no-filter,search,South Korea’s Stock Market Eyes MSCI Developed Status After Volatile Rally,"After one of its most volatile weeks in years, South Korea’s stock market is approaching a milestone it has long been chasing: a potential path into MSCI Inc.’s developed-market status.",https://www.bloomberg.com/news/articles/2026-06-14/world-s-hottest-stock-market-turns-attention-to-msci-moment,Bloomberg,2026-06-14T00:00:00Z,중립,"South Korea’s Stock Market Eyes MSCI Developed Status After Volatile Rally — After one of its most volatile weeks in years, South Korea’s stock market is approaching a milestone it has long been chasing: a potential path into MSCI Inc.’s developed-market st",OK,2026-06-16T18:03:01
미국주식,Nvidia AI semiconductor stocks,AI semiconductor/en/us,search,Nvidia's Taiwan Investment Signals A New AI Supply Chain Reality,Nvidia plans to spend $150B a year in Taiwan. Here's what that means for the AI supply chain and investors watching semiconductor stocks.,https://www.benzinga.com/Opinion/26/05/52808834/nvidias-taiwan-investment-signals-a-new-ai-supply-chain-reality,Benzinga,2026-05-27T14:04:22Z,중립,Nvidia's Taiwan Investment Signals A New AI Supply Chain Reality — Nvidia plans to spend $150B a year in Taiwan. Here's what that means for the AI supply chain and investors watching semiconductor stocks.,OK,2026-06-16T18:03:02
미국주식,Nvidia AI semiconductor stocks,AI semiconductor/en/us,search,Nvidia earnings spark $350 billion market swing as AI bubble tests investor nerves,"Nvidia shares could move 6.5% after earnings, representing a $350 billion market value swing. Bitcoin fell below $78,000 as US traders sold off ahead of Nvidia’s Q1 report. The chipmaker delivered its 15th consecutive quarterly revenue beat with strong Q2 guidance. Options trading shows investors are bullish but hedging gains after semiconductor stocks rose 57% […]",https://www.naturalnews.com/2026-05-22-nvidia-earnings-spark-350b-market-swing.html,Natural News,2026-05-22T11:08:28Z,긍정,"Nvidia earnings spark $350 billion market swing as AI bubble tests investor nerves — Nvidia shares could move 6.5% after earnings, representing a $350 billion market value swing. Bitcoin fell below $78,000 as US traders sold off ahead of Nvidia’s Q1 report. The chi",OK,2026-06-16T18:03:02
미국주식,Nvidia AI semiconductor stocks,AI semiconductor/en/us,search,Nvidia Revenue Rockets 85%: 3 Undervalued Top AI Chip Stocks,"Nvidia blew past expectations, but its stock barely budged. Discover three undervalued semiconductor plays with strong upside potential.",https://seekingalpha.com/article/4907686-nvidia-revenue-rockets-85-percent-3-undervalued-top-ai-chip-stocks,Seeking Alpha,2026-05-21T20:00:08Z,긍정,"Nvidia Revenue Rockets 85%: 3 Undervalued Top AI Chip Stocks — Nvidia blew past expectations, but its stock barely budged. Discover three undervalued semiconductor plays with strong upside potential.",OK,2026-06-16T18:03:02
