market,query,attempt_label,endpoint,title,description,url,source,publishedAt,sentiment,summary_ko,status,fetched_at
한국주식,KOSPI stock market,KOSPI/en/kr,search,This $1 Trillion Kospi Whale Has Made a Grave Mistake,Does the world’s hottest stock market still have an anchor? Not any more after South Korea’s $1 trillion pension fund bent its own rules in pursuit of better returns.,https://www.bloomberg.com/opinion/articles/2026-06-16/this-1-trillion-kospi-whale-has-made-a-grave-mistake,Bloomberg,2026-06-16T18:00:18Z,중립,This $1 Trillion Kospi Whale Has Made a Grave Mistake — Does the world’s hottest stock market still have an anchor? Not any more after South Korea’s $1 trillion pension fund bent its own rules in pursuit of better returns.,OK,2026-06-17T22:51:02
한국주식,KOSPI stock market,KOSPI/en/kr,search,"Goldman Urges Clients To Hedge For Kospi Drawdown, As Korea's Banks Cap Loans To Curb Stock Market Frenzy","ZeroHedge - On a long enough timeline, the survival rate for everyone drops to zero",https://www.zerohedge.com/markets/goldman-urges-clients-hedge-kospi-drawdown-koreas-banks-cap-loans-curb-stock-market-frenzy,ZeroHedge,2026-06-16T03:01:49Z,중립,"Goldman Urges Clients To Hedge For Kospi Drawdown, As Korea's Banks Cap Loans To Curb Stock Market Frenzy — ZeroHedge - On a long enough timeline, the survival rate for everyone drops to zero",OK,2026-06-17T22:51:02
한국주식,KOSPI stock market,KOSPI/en/kr,search,"Stock market, US Iran deal: Sensex, Nifty gap up start likely; stocks to watch",Stock market today: South Korea's Kospi and Japan's Nikkei jumped 5 per cent each. Mainland China's Shanghai Composite and Hong Kong's Hang Seng advanced 1 per cent each.,https://www.businesstoday.in/markets/stocks/story/stock-market-us-iran-deal-sensex-nifty-set-to-see-gap-up-start-stocks-to-watch-536803-2026-06-15,Business Today,2026-06-15T02:30:26Z,중립,"Stock market, US Iran deal: Sensex, Nifty gap up start likely; stocks to watch — Stock market today: South Korea's Kospi and Japan's Nikkei jumped 5 per cent each. Mainland China's Shanghai Composite and Hong Kong's Hang Seng advanced 1 per cent each.",OK,2026-06-17T22:51:02
한국주식,KOSPI stock market,KOSPI/en/kr,search,World's hottest stock market turns focus to MSCI moment,"South Korea's stock market is nearing a significant milestone. Investors are watching for a potential upgrade to developed-market status by MSCI. The Kospi has seen a massive surge this year, fueled by artificial intelligence stocks. While volatility is high, reforms are underway.",https://economictimes.indiatimes.com/markets/stocks/news/worlds-hottest-stock-market-turns-focus-to-msci-moment/articleshow/131730711.cms,The Economic Times,2026-06-15T00:01:00Z,긍정,World's hottest stock market turns focus to MSCI moment — South Korea's stock market is nearing a significant milestone. Investors are watching for a potential upgrade to developed-market status by MSCI. The Kospi has seen a massive surge,OK,2026-06-17T22:51:02
한국주식,KOSPI stock market,KOSPI/en/kr,search,South Korea's world-beating stock market eyes long-awaited MSCI moment,"The Kospi has become the world's best-performing major equity benchmark this year, surging more than 90% as investors piled into artificial-intelligence winners",https://www.business-standard.com/markets/news/south-korea-s-world-beating-stock-market-eyes-long-awaited-msci-moment-126061400076_1.html,Business Standard,2026-06-14T01:45:19Z,중립,"South Korea's world-beating stock market eyes long-awaited MSCI moment — The Kospi has become the world's best-performing major equity benchmark this year, surging more than 90% as investors piled into artificial-intelligence winners",OK,2026-06-17T22:51:02
한국주식,KOSPI stock market,KOSPI/en/kr,search,South Korea’s world-beating stock market eyes its MSCI moment,"The Kospi has become the world’s best-performing major equity benchmark this year, surging more than 90% as investors piled into artificial-intelligence winners.",https://www.moneycontrol.com/news/business/south-korea-s-world-beating-stock-market-eyes-its-msci-moment-13948919.html,Moneycontrol,2026-06-14T01:21:28Z,중립,"South Korea’s world-beating stock market eyes its MSCI moment — The Kospi has become the world’s best-performing major equity benchmark this year, surging more than 90% as investors piled into artificial-intelligence winners.",OK,2026-06-17T22:51:02
한국주식,KOSPI stock market,KOSPI/en/kr,search,South Korea's Kospi jumps over 8%; world's best performing market up 95% in 2026 so far,"The South Korean benchmark remains the world's best-performing major stock index in 2026. The KOSPI has gained 95.43 per cent so far this year, supported largely by strong buying in semiconductor stocks amid continued enthusiasm around artificial intelligence (AI)-related themes.",https://www.businesstoday.in/markets/stocks/story/south-koreas-kospi-jumps-over-8-worlds-best-performing-market-up-95-in-2026-so-far-536470-2026-06-12,Business Today,2026-06-12T05:21:22Z,긍정,"South Korea's Kospi jumps over 8%; world's best performing market up 95% in 2026 so far — The South Korean benchmark remains the world's best-performing major stock index in 2026. The KOSPI has gained 95.43 per cent so far this year, supported largely by strong buying i",OK,2026-06-17T22:51:02
한국주식,KOSPI stock market,KOSPI/en/kr,search,Stock Market LIVE: GIFT Nifty gains 200 pts; Kospi jumps 8% as Trump says deal with Iran is close,"Sensex Today | Stock Market LIVE Updates, June 12: The GIFT Nifty indicated a positive open as US President Donald Trump indicated a deal with Iran is expected soon. South Korea's Kospi jumped over 8%",https://www.business-standard.com/markets/news/stock-market-live-june-12-nse-bse-sensex-today-nifty-gift-nifty-us-iran-deal-brent-crude-oil-price-ipo-126061200119_1.html,Business Standard,2026-06-12T02:41:48Z,중립,"Stock Market LIVE: GIFT Nifty gains 200 pts; Kospi jumps 8% as Trump says deal with Iran is close — Sensex Today | Stock Market LIVE Updates, June 12: The GIFT Nifty indicated a positive open as US President Donald Trump indicated a deal with Iran is expected soon. South Korea's ",OK,2026-06-17T22:51:02
한국주식,KOSPI stock market,KOSPI/en/kr,search,"Stock market, Trump Iran deal: Brent below $90, Asian shares rallying; will Sensex, Nifty join the party?","Kospi climbed 7.66 per cent to 8,358.33. Japan's Nikkei was up 3.77 per cent at 66,640. Markets across Hong Kong and mainland China advanced 1.3-1.6 per cent each.",https://www.businesstoday.in/markets/stocks/story/stock-market-trump-iran-deal-brent-below-90-asian-shares-rallying-will-sensex-nifty-join-the-party-536433-2026-06-12,Business Today,2026-06-12T02:25:41Z,중립,"Stock market, Trump Iran deal: Brent below $90, Asian shares rallying; will Sensex, Nifty join the party? — Kospi climbed 7.66 per cent to 8,358.33. Japan's Nikkei was up 3.77 per cent at 66,640. Markets across Hong Kong and mainland China advanced 1.3-1.6 per cent each.",OK,2026-06-17T22:51:02
미국주식,stock market,wide stock market/no-filter,search,"Stock Market News Today Live Updates: GIFT Nifty Points To Positive Open For Nifty, Sensex; Brent Crude Holds Below $80 A Barrel","The GIFT Nifty, an early indicator of Nifty 50's performance, traded at 24,042.50, compared to Tuesday's index close of 23,989.15.",https://www.ndtvprofit.com/markets/stock-market-crash-news-today-live-updates-share-market-sensex-nifty-gift-nifty-iran-war-us-attack-oil-market-impact-us-fed-rate-fno-futures-11646845,NDTV Profit,2026-06-17T01:40:58Z,중립,"Stock Market News Today Live Updates: GIFT Nifty Points To Positive Open For Nifty, Sensex; Brent Crude Holds Below $80 A Barrel — The GIFT Nifty, an early indicator of Nifty 50's performance, traded at 24,042.50, compared to Tuesday's index close of 23,989.15.",OK,2026-06-17T22:51:05
미국주식,stock market,wide stock market/no-filter,search,"Australia’s richest woman buys stake worth $1 billion in SpaceX, says: Elon has done what ...","Tech News News: Elon Musk's SpaceX made a historic debut on the stock market last week. Since then, the rocket company's market value has reached $2.5 trillion, makin.",https://timesofindia.indiatimes.com/technology/tech-news/australias-richest-woman-buys-stake-worth-1-billion-in-spacex-says-elon-has-done-what-/articleshow/131781298.cms,Times of India,2026-06-17T01:39:00Z,중립,"Australia’s richest woman buys stake worth $1 billion in SpaceX, says: Elon has done what ... — Tech News News: Elon Musk's SpaceX made a historic debut on the stock market last week. Since then, the rocket company's market value has reached $2.5 trillion, makin.",OK,2026-06-17T22:51:05
미국주식,stock market,wide stock market/no-filter,search,"From Gift Nifty, US tech stocks selloff to oil prices: 8 key things that changed for Indian stock market overnight","Gift Nifty was trading around 24,032 level, a premium of nearly 31 points from the Nifty futures’ previous close, indicating a flat-to-positive start for the Indian stock market indices.",https://www.livemint.com/market/stock-market-news/from-gift-nifty-us-tech-stocks-selloff-to-oil-prices-8-key-things-that-changed-for-indian-stock-market-overnight-11781658244588.html,Livemint,2026-06-17T01:37:05Z,중립,"From Gift Nifty, US tech stocks selloff to oil prices: 8 key things that changed for Indian stock market overnight — Gift Nifty was trading around 24,032 level, a premium of nearly 31 points from the Nifty futures’ previous close, indicating a flat-to-positive start for the Indian stock market in",OK,2026-06-17T22:51:05
미국주식,stock market,wide stock market/no-filter,search,Breakout stocks to buy or sell: Sumeet Bagadia recommends five shares to buy today - 17 June 2026,The Indian stock market ended Tuesday's session on a higher note. Sumeet Bagadia of Choice Broking recommends five breakout stocks to buy today.,https://www.livemint.com/market/stock-market-news/breakout-stocks-to-buy-or-sell-sumeet-bagadia-recommends-five-shares-to-buy-today-17-june-2026-11781657536129.html,Livemint,2026-06-17T01:11:53Z,중립,Breakout stocks to buy or sell: Sumeet Bagadia recommends five shares to buy today - 17 June 2026 — The Indian stock market ended Tuesday's session on a higher note. Sumeet Bagadia of Choice Broking recommends five breakout stocks to buy today.,OK,2026-06-17T22:51:05
미국주식,stock market,wide stock market/no-filter,search,"Sensex Today | Stock Market Live: Nifty opens above 24,000, Sensex up 130 pts; Dixon Tech, Trent, Wipro gain","Sensex Today | Stock Market LIVE Updates: Stocks like Sonata Software, Utkal Speciality Industries India, Cyient, Brigade Enterprises, Prime Focus, Bharat Forge, Krishna Institute of Medical Sciences, Wipro, and DOMS Industries will be in focus on June 17.",https://www.moneycontrol.com/news/business/markets/sensex-today-stock-market-live-updates-nifty50-share-price-crude-fii-gift-nifty-rupee-latest-updates-17-06-2026-liveblog-13951463.html,Moneycontrol,2026-06-17T01:10:00Z,긍정,"Sensex Today | Stock Market Live: Nifty opens above 24,000, Sensex up 130 pts; Dixon Tech, Trent, Wipro gain — Sensex Today | Stock Market LIVE Updates: Stocks like Sonata Software, Utkal Speciality Industries India, Cyient, Brigade Enterprises, Prime Focus, Bharat Forge, Krishna Institute ",OK,2026-06-17T22:51:05
미국주식,stock market,wide stock market/no-filter,search,"Stock Market Highlights June 17: Sensex gains 347 pts, Nifty closes at 24,085 on easing crude oil prices","Sensex Today, Nifty 50 | Stock Market Highlights - Find here all the highlights related to Sensex, Nifty, BSE, NSE, share prices and Indian stock markets for 17th June 2026.",https://www.thehindubusinessline.com/markets/sensex-nifty50-today-stock-market-highlights-17-june-2026/article71108765.ece,The Hindu Business Line,2026-06-17T01:01:23Z,중립,"Stock Market Highlights June 17: Sensex gains 347 pts, Nifty closes at 24,085 on easing crude oil prices — Sensex Today, Nifty 50 | Stock Market Highlights - Find here all the highlights related to Sensex, Nifty, BSE, NSE, share prices and Indian stock markets for 17th June 2026.",OK,2026-06-17T22:51:05
미국주식,stock market,wide stock market/no-filter,search,SpaceX overtakes Amazon in value as post-IPO rally reaches 49%,"Its market capitalization is roughly $8 billion higher than Amazon’s at the close of trading on Tuesday, making it the fifth-largest stock in the world.",https://www.japantimes.co.jp/business/2026/06/17/companies/spacex-amazon-value-ipo-49/,The Japan Times ,2026-06-17T00:57:48Z,중립,"SpaceX overtakes Amazon in value as post-IPO rally reaches 49% — Its market capitalization is roughly $8 billion higher than Amazon’s at the close of trading on Tuesday, making it the fifth-largest stock in the world.",OK,2026-06-17T22:51:05
미국주식,stock market,wide stock market/no-filter,search,Sensex Today | Stock Market LIVE Updates: Nifty futures hint at a positive start; Brent below $80,"Sensex Today | Stock Market LIVE Updates: Wednesday's, the day between two weekly expiries are the trending days in the market based on recent history, and the Nifty bulls would hope that the trend is now decisively towards the upside. With oil prices nearly back to pre-war levels, the one macro headwind that the markets had is slowly falling back into place.",https://www.cnbctv18.com/market/stock-market-live-updates-sensex-nifty-50-oil-it-banks-ril-brigade-doms-vmm-gic-kims-hul-hdfc-bank-bse-share-price-liveblog-19926800.htm,CNBC TV18,2026-06-17T00:45:16Z,중립,"Sensex Today | Stock Market LIVE Updates: Nifty futures hint at a positive start; Brent below $80 — Sensex Today | Stock Market LIVE Updates: Wednesday's, the day between two weekly expiries are the trending days in the market based on recent history, and the Nifty bulls would ho",OK,2026-06-17T22:51:05
미국주식,stock market,wide stock market/no-filter,search,Raja Venkatraman recommends three stocks for 17 June,Market expert Raja Venkatraman shares his top stock picks for 17 June. Here’s his technical outlook and trade strategy.,https://www.livemint.com/market/stock-market-news/raja-venkatraman-recommends-three-stocks-for-17-june-11781612045215.html,Livemint,2026-06-17T00:30:17Z,중립,Raja Venkatraman recommends three stocks for 17 June — Market expert Raja Venkatraman shares his top stock picks for 17 June. Here’s his technical outlook and trade strategy.,OK,2026-06-17T22:51:05
미국주식,stock market,wide stock market/no-filter,search,Stock Market Today: All You Need To Know Going Into Trade On June 17,"Stocks in the news, big brokerage calls of the day, complete trade setup and much more!",https://www.ndtvprofit.com/markets/stock-market-today-all-you-need-to-know-going-into-trade-on-june-17-11646110,NDTV Profit,2026-06-17T00:30:01Z,중립,"Stock Market Today: All You Need To Know Going Into Trade On June 17 — Stocks in the news, big brokerage calls of the day, complete trade setup and much more!",OK,2026-06-17T22:51:05
